id,favourites_count,retweet_count,full_text,description,t_link,expanded_url
717841801130979328,114031,670,This is Barclay. His father was a banana. 11/10 appeeling af https://t.co/ucOEfr2rjV,"#1 Source for Professional Dog Ratings | STORE: @ShopWeRateDogs | IG, FB & SC: WeRateDogs MOBILE APP: @GoodDogsGame | Business: dogratingtwitter@gmail.com",https://t.co/ucOEfr2rjV,https://twitter.com/dog_rates/status/717841801130979328/photo/1
717790033953034240,114031,1272,"Here's a badass mystery pupper. You weren't aware that you owe him money, but you do. 10/10 shades sick af https://t.co/fv9e9AtzSG","#1 Source for Professional Dog Ratings | STORE: @ShopWeRateDogs | IG, FB & SC: WeRateDogs MOBILE APP: @GoodDogsGame | Business: dogratingtwitter@gmail.com",https://t.co/fv9e9AtzSG,https://twitter.com/dog_rates/status/717790033953034240/photo/1
717537687239008257,114031,2069,People please. This is a Deadly Mediterranean Plop T-Rex. We only rate dogs. Only send in dogs. Thanks you... 11/10 https://t.co/2ATDsgHD4n,"#1 Source for Professional Dog Ratings | STORE: @ShopWeRateDogs | IG, FB & SC: WeRateDogs MOBILE APP: @GoodDogsGame | Business: dogratingtwitter@gmail.com",https://t.co/2ATDsgHD4n,https://twitter.com/dog_rates/status/717537687239008257/photo/1
717428917016076293,114031,510,This is Skittle. He's trying to communicate. 11/10 solid effort https://t.co/6WTfJvtKx6,"#1 Source for Professional Dog Ratings | STORE: @ShopWeRateDogs | IG, FB & SC: WeRateDogs MOBILE APP: @GoodDogsGame | Business: dogratingtwitter@gmail.com",NaN,NaN
717421804990701568,114031,945,This is Ebby. She's a Zimbabwean Feta. Embarrassed by ridiculously squishy face. 9/10 would squeeze softly https://t.co/LBJqxMGaHi,"#1 Source for Professional Dog Ratings | STORE: @ShopWeRateDogs | IG, FB & SC: WeRateDogs MOBILE APP: @GoodDogsGame | Business: dogratingtwitter@gmail.com",https://t.co/LBJqxMGaHi,https://twitter.com/dog_rates/status/717421804990701568/photo/1
717047459982213120,114031,2135,This is FlÃ¡vio (pronounced Baxter). He's a Benesnoop Cumberdog. Super rare. Symmetrical. 12/10 would pet so well https://t.co/fGgleFiBPq,"#1 Source for Professional Dog Ratings | STORE: @ShopWeRateDogs | IG, FB & SC: WeRateDogs MOBILE APP: @GoodDogsGame | Business: dogratingtwitter@gmail.com",https://t.co/fGgleFiBPq,https://twitter.com/dog_rates/status/717047459982213120/photo/1
717009362452090881,114031,1102,This is Smokey. He's having some sort of existential crisis. 10/10 hang in there pupper https://t.co/JmgF4dMpw0,"#1 Source for Professional Dog Ratings | STORE: @ShopWeRateDogs | IG, FB & SC: WeRateDogs MOBILE APP: @GoodDogsGame | Business: dogratingtwitter@gmail.com",https://t.co/JmgF4dMpw0,https://twitter.com/dog_rates/status/717009362452090881/photo/1
716802964044845056,114031,1317,This is Link. He struggles with couches. 10/10 would assist https://t.co/SbX4e6Yg3o,"#1 Source for Professional Dog Ratings | STORE: @ShopWeRateDogs | IG, FB & SC: WeRateDogs MOBILE APP: @GoodDogsGame | Business: dogratingtwitter@gmail.com",https://t.co/SbX4e6Yg3o,https://twitter.com/dog_rates/status/716802964044845056/photo/1
716791146589110272,114031,1474,Meet Jennifur. She's supposed to be navigating. Not even buckled up. Insubordinate &amp; churlish. 11/10 would still pet https://t.co/h0trcJohYO,"#1 Source for Professional Dog Ratings | STORE: @ShopWeRateDogs | IG, FB & SC: WeRateDogs MOBILE APP: @GoodDogsGame | Business: dogratingtwitter@gmail.com",https://t.co/h0trcJohYO,https://twitter.com/dog_rates/status/716791146589110272/photo/1
716730379797970944,114031,475,"There has clearly been a mistake. Pup did nothing wrong. 12/10 would help escape
https://t.co/Juid3nnLbC","#1 Source for Professional Dog Ratings | STORE: @ShopWeRateDogs | IG, FB & SC: WeRateDogs MOBILE APP: @GoodDogsGame | Business: dogratingtwitter@gmail.com",NaN,NaN
716447146686459905,114031,6643,This is Ozzy. He's acrobatic af. Legendary pupper status achieved. 13/10 https://t.co/gHWsCTu90E,"#1 Source for Professional Dog Ratings | STORE: @ShopWeRateDogs | IG, FB & SC: WeRateDogs MOBILE APP: @GoodDogsGame | Business: dogratingtwitter@gmail.com",NaN,NaN
716439118184652801,114031,247,This is Bluebert. He just saw that both #FinalFur match ups are split 50/50. Amazed af. 11/10 https://t.co/Kky1DPG4iq,"#1 Source for Professional Dog Ratings | STORE: @ShopWeRateDogs | IG, FB & SC: WeRateDogs MOBILE APP: @GoodDogsGame | Business: dogratingtwitter@gmail.com",https://t.co/Kky1DPG4iq,https://twitter.com/dog_rates/status/716439118184652801/photo/1
716285507865542656,114031,1225,This is Stephanus. She stays woke. 12/10 https://t.co/WIWabMngQZ,"#1 Source for Professional Dog Ratings | STORE: @ShopWeRateDogs | IG, FB & SC: WeRateDogs MOBILE APP: @GoodDogsGame | Business: dogratingtwitter@gmail.com",https://t.co/WIWabMngQZ,https://twitter.com/dog_rates/status/716285507865542656/photo/1
716080869887381504,114031,1935,Here's a super majestic doggo and a sunset 11/10 https://t.co/UACnoyi8zu,"#1 Source for Professional Dog Ratings | STORE: @ShopWeRateDogs | IG, FB & SC: WeRateDogs MOBILE APP: @GoodDogsGame | Business: dogratingtwitter@gmail.com",https://t.co/UACnoyi8zu,https://twitter.com/dog_rates/status/716080869887381504/photo/1
715928423106027520,114031,987,This is Bubbles. He's a Yorkshire Piccolope. 11/10 would snug aggressively https://t.co/3BhMojONxq,"#1 Source for Professional Dog Ratings | STORE: @ShopWeRateDogs | IG, FB & SC: WeRateDogs MOBILE APP: @GoodDogsGame | Business: dogratingtwitter@gmail.com",https://t.co/3BhMojONxq,https://twitter.com/dog_rates/status/715928423106027520/photo/1
715758151270801409,114031,1596,This is old now but it's absolutely heckin fantastic and I can't not share it with you all. 13/10  https://t.co/wJX74TSgzP,"#1 Source for Professional Dog Ratings | STORE: @ShopWeRateDogs | IG, FB & SC: WeRateDogs MOBILE APP: @GoodDogsGame | Business: dogratingtwitter@gmail.com",NaN,NaN
715733265223708672,114031,1920,This is a taco. We only rate dogs. Please only send in dogs. Dogs are what we rate. Not tacos. Thank you... 10/10 https://t.co/cxl6xGY8B9,"#1 Source for Professional Dog Ratings | STORE: @ShopWeRateDogs | IG, FB & SC: WeRateDogs MOBILE APP: @GoodDogsGame | Business: dogratingtwitter@gmail.com",https://t.co/cxl6xGY8B9,https://twitter.com/dog_rates/status/715733265223708672/photo/1
715704790270025728,114031,634,This is Bentley. He gives kisses back. 11/10 precious af (vid by @emmaallen25) https://t.co/9PnKkKzoUp,"#1 Source for Professional Dog Ratings | STORE: @ShopWeRateDogs | IG, FB & SC: WeRateDogs MOBILE APP: @GoodDogsGame | Business: dogratingtwitter@gmail.com",NaN,NaN
715696743237730304,114031,1454,Meet Toby. He's a Lithuanian High-Steppin Stickeroo. One of the more accomplished Stickeroos around. 10/10 so nifty https://t.co/cYPHuJYTjC,"#1 Source for Professional Dog Ratings | STORE: @ShopWeRateDogs | IG, FB & SC: WeRateDogs MOBILE APP: @GoodDogsGame | Business: dogratingtwitter@gmail.com",https://t.co/cYPHuJYTjC,https://twitter.com/dog_rates/status/715696743237730304/photo/1
715680795826982913,114031,1813,This is Zeus. He's downright fabulous. 12/10 https://t.co/sSugyyRuTp,"#1 Source for Professional Dog Ratings | STORE: @ShopWeRateDogs | IG, FB & SC: WeRateDogs MOBILE APP: @GoodDogsGame | Business: dogratingtwitter@gmail.com",https://t.co/sSugyyRuTp,https://twitter.com/dog_rates/status/715680795826982913/photo/1
715360349751484417,114031,1772,This is Bertson. He just wants to say hi. 11/10 would boop nose https://t.co/hwv7Wq6gDA,"#1 Source for Professional Dog Ratings | STORE: @ShopWeRateDogs | IG, FB & SC: WeRateDogs MOBILE APP: @GoodDogsGame | Business: dogratingtwitter@gmail.com",https://t.co/hwv7Wq6gDA,https://twitter.com/dog_rates/status/715360349751484417/photo/1
715342466308784130,114031,768,This is Oscar. He's a world renowned snowball inspector. It's a ruff job but someone has to do it. 10/10 great guy https://t.co/vSufMAKm3C,"#1 Source for Professional Dog Ratings | STORE: @ShopWeRateDogs | IG, FB & SC: WeRateDogs MOBILE APP: @GoodDogsGame | Business: dogratingtwitter@gmail.com",https://t.co/vSufMAKm3C,https://twitter.com/dog_rates/status/715342466308784130/photo/1
715220193576927233,114031,736,This is Nico. His selfie game is strong af. Excellent use of a sneaky tongue slip. 10/10 star material https://t.co/1OBdJkMOFx,"#1 Source for Professional Dog Ratings | STORE: @ShopWeRateDogs | IG, FB & SC: WeRateDogs MOBILE APP: @GoodDogsGame | Business: dogratingtwitter@gmail.com",https://t.co/1OBdJkMOFx,https://twitter.com/dog_rates/status/715220193576927233/photo/1
715200624753819648,114031,2110,This is Michelangelope. He's half coffee cup. Rare af. 12/10 would hug until someone stopped me https://t.co/tvVDY0G911,"#1 Source for Professional Dog Ratings | STORE: @ShopWeRateDogs | IG, FB & SC: WeRateDogs MOBILE APP: @GoodDogsGame | Business: dogratingtwitter@gmail.com",https://t.co/tvVDY0G911,https://twitter.com/dog_rates/status/715200624753819648/photo/1
715009755312439296,114031,1392,This is Siba. She's remarkably mobile. Very sleepy as well. 12/10 would happily transport https://t.co/TjnI33RE1i,"#1 Source for Professional Dog Ratings | STORE: @ShopWeRateDogs | IG, FB & SC: WeRateDogs MOBILE APP: @GoodDogsGame | Business: dogratingtwitter@gmail.com",https://t.co/TjnI33RE1i,https://twitter.com/dog_rates/status/715009755312439296/photo/1
714982300363173890,114031,1166,This is Calbert. He forgot to clear his Google search history. 9/10 rookie mistake Calbert https://t.co/jRm5J3YCmj,"#1 Source for Professional Dog Ratings | STORE: @ShopWeRateDogs | IG, FB & SC: WeRateDogs MOBILE APP: @GoodDogsGame | Business: dogratingtwitter@gmail.com",https://t.co/jRm5J3YCmj,https://twitter.com/dog_rates/status/714982300363173890/photo/1
714962719905021952,114031,4816,Just in case anyone's having a bad day. 12/10 would bounce with https://t.co/T9sgP9ttnQ,"#1 Source for Professional Dog Ratings | STORE: @ShopWeRateDogs | IG, FB & SC: WeRateDogs MOBILE APP: @GoodDogsGame | Business: dogratingtwitter@gmail.com",NaN,NaN
714957620017307648,114031,1595,This is Curtis. He's an Albino Haberdasher. Terrified of dandelions. They really spook him up. 10/10 it'll be ok pup https://t.co/s8YcfZrWhK,"#1 Source for Professional Dog Ratings | STORE: @ShopWeRateDogs | IG, FB & SC: WeRateDogs MOBILE APP: @GoodDogsGame | Business: dogratingtwitter@gmail.com",https://t.co/s8YcfZrWhK,https://twitter.com/dog_rates/status/714957620017307648/photo/1
714631576617938945,114031,1122,This is Benedict. He's a feisty pup. Needs a brushing. Portable af. Looks very angry actually. 4/10 might not pet https://t.co/3oeFfHjv0Z,"#1 Source for Professional Dog Ratings | STORE: @ShopWeRateDogs | IG, FB & SC: WeRateDogs MOBILE APP: @GoodDogsGame | Business: dogratingtwitter@gmail.com",https://t.co/3oeFfHjv0Z,https://twitter.com/dog_rates/status/714631576617938945/photo/1
714606013974974464,114031,1038,Here are two lil cuddly puppers. Both 12/10 would snug like so much https://t.co/zO4eb7C4tG,"#1 Source for Professional Dog Ratings | STORE: @ShopWeRateDogs | IG, FB & SC: WeRateDogs MOBILE APP: @GoodDogsGame | Business: dogratingtwitter@gmail.com",https://t.co/zO4eb7C4tG,https://twitter.com/dog_rates/status/714606013974974464/photo/1
714485234495041536,114031,1313,This is Blitz. He screams. 10/10 (vid by @yeaahliv) https://t.co/MfW2aym5UF,"#1 Source for Professional Dog Ratings | STORE: @ShopWeRateDogs | IG, FB & SC: WeRateDogs MOBILE APP: @GoodDogsGame | Business: dogratingtwitter@gmail.com",NaN,NaN
714258258790387713,114031,808,"Meet Travis and Flurp. Travis is pretty chill but Flurp can't lie down properly. 10/10 &amp; 8/10
get it together Flurp https://t.co/Akzl5ynMmE","#1 Source for Professional Dog Ratings | STORE: @ShopWeRateDogs | IG, FB & SC: WeRateDogs MOBILE APP: @GoodDogsGame | Business: dogratingtwitter@gmail.com",https://t.co/Akzl5ynMmE,https://twitter.com/dog_rates/status/714258258790387713/photo/1
714251586676113411,114031,940,This is Thumas. He hates potted plants. 8/10 wtf Thumas https://t.co/rDVueNIcEi,"#1 Source for Professional Dog Ratings | STORE: @ShopWeRateDogs | IG, FB & SC: WeRateDogs MOBILE APP: @GoodDogsGame | Business: dogratingtwitter@gmail.com",https://t.co/rDVueNIcEi,https://twitter.com/dog_rates/status/714251586676113411/photo/1
714214115368108032,114031,990,Happy Easter from the squad! ðŸ‡ðŸ¶ 13/10 for all https://t.co/YMx4KWJUAB,"#1 Source for Professional Dog Ratings | STORE: @ShopWeRateDogs | IG, FB & SC: WeRateDogs MOBILE APP: @GoodDogsGame | Business: dogratingtwitter@gmail.com",https://t.co/YMx4KWJUAB,https://twitter.com/dog_rates/status/714214115368108032/photo/1
714141408463036416,114031,1569,"I know we only rate dogs, but since it's Easter I guess we could rate a bunny for a change. 10/10 petable as hell https://t.co/O2RlKXigHu","#1 Source for Professional Dog Ratings | STORE: @ShopWeRateDogs | IG, FB & SC: WeRateDogs MOBILE APP: @GoodDogsGame | Business: dogratingtwitter@gmail.com",https://t.co/O2RlKXigHu,https://twitter.com/dog_rates/status/714141408463036416/photo/1
713919462244790272,114031,869,This is Kanu. He's a Freckled Ticonderoga. Simply flawless. 12/10 would perform an elaborate heist to capture https://t.co/7vyAzIURrE,"#1 Source for Professional Dog Ratings | STORE: @ShopWeRateDogs | IG, FB & SC: WeRateDogs MOBILE APP: @GoodDogsGame | Business: dogratingtwitter@gmail.com",https://t.co/7vyAzIURrE,https://twitter.com/dog_rates/status/713919462244790272/photo/1
713909862279876608,114031,616,This is Doug. His nose is legendary af. 12/10 (vid by @probably_trey) https://t.co/7IWKfbfihS,"#1 Source for Professional Dog Ratings | STORE: @ShopWeRateDogs | IG, FB & SC: WeRateDogs MOBILE APP: @GoodDogsGame | Business: dogratingtwitter@gmail.com",NaN,NaN
713900603437621249,114031,829,Happy Saturday here's 9 puppers on a bench. 99/90 good work everybody https://t.co/mpvaVxKmc1,"#1 Source for Professional Dog Ratings | STORE: @ShopWeRateDogs | IG, FB & SC: WeRateDogs MOBILE APP: @GoodDogsGame | Business: dogratingtwitter@gmail.com",https://t.co/mpvaVxKmc1,https://twitter.com/dog_rates/status/713900603437621249/photo/1
713761197720473600,114031,1541,This is Piper. She would really like that tennis ball core. Super sneaky tongue slip. 12/10 precious af https://t.co/QP6GHi5az9,"#1 Source for Professional Dog Ratings | STORE: @ShopWeRateDogs | IG, FB & SC: WeRateDogs MOBILE APP: @GoodDogsGame | Business: dogratingtwitter@gmail.com",https://t.co/QP6GHi5az9,https://twitter.com/dog_rates/status/713761197720473600/photo/1
713411074226274305,114031,1440,Here we see an extremely rare Bearded Floofmallow. Only a few left in the wild. 11/10 would pet with a purpose https://t.co/jVJJKlPbvq,"#1 Source for Professional Dog Ratings | STORE: @ShopWeRateDogs | IG, FB & SC: WeRateDogs MOBILE APP: @GoodDogsGame | Business: dogratingtwitter@gmail.com",https://t.co/jVJJKlPbvq,https://twitter.com/dog_rates/status/713411074226274305/photo/1
713177543487135744,114031,3183,This is Lance. Lance doesn't give a shit. 10/10 we should all be more like Lance https://t.co/SqnG9Ap28J,"#1 Source for Professional Dog Ratings | STORE: @ShopWeRateDogs | IG, FB & SC: WeRateDogs MOBILE APP: @GoodDogsGame | Business: dogratingtwitter@gmail.com",https://t.co/SqnG9Ap28J,https://twitter.com/dog_rates/status/713177543487135744/photo/1
713175907180089344,114031,1630,Say hello to Opie and Clarkus. Clarkus fell asleep so Opie buried him. Ruthless af 10/10 for both https://t.co/xT7XaY4gnW,"#1 Source for Professional Dog Ratings | STORE: @ShopWeRateDogs | IG, FB & SC: WeRateDogs MOBILE APP: @GoodDogsGame | Business: dogratingtwitter@gmail.com",https://t.co/xT7XaY4gnW,https://twitter.com/dog_rates/status/713175907180089344/photo/1
712809025985978368,114031,7602,This is Stubert. He just arrived. 10/10 https://t.co/HVGs5aAKAn,"#1 Source for Professional Dog Ratings | STORE: @ShopWeRateDogs | IG, FB & SC: WeRateDogs MOBILE APP: @GoodDogsGame | Business: dogratingtwitter@gmail.com",https://t.co/HVGs5aAKAn,https://twitter.com/dog_rates/status/712809025985978368/photo/1
712717840512598017,114031,5616,Please don't send in any more polar bears. We only rate dogs. Thank you... 10/10 https://t.co/83RGhdIQz2,"#1 Source for Professional Dog Ratings | STORE: @ShopWeRateDogs | IG, FB & SC: WeRateDogs MOBILE APP: @GoodDogsGame | Business: dogratingtwitter@gmail.com",https://t.co/83RGhdIQz2,https://twitter.com/dog_rates/status/712717840512598017/photo/1
712668654853337088,114031,1367,Say hello to Sunny and Roxy. They pull things out of water together. 10/10 for both https://t.co/88aedAmxcl,"#1 Source for Professional Dog Ratings | STORE: @ShopWeRateDogs | IG, FB & SC: WeRateDogs MOBILE APP: @GoodDogsGame | Business: dogratingtwitter@gmail.com",https://t.co/88aedAmxcl,https://twitter.com/dog_rates/status/712668654853337088/photo/1
712438159032893441,114031,1756,This is Kane. He's a semi-submerged Haitian Huffleplop. Happy af. Sick waterfall. 11/10 would pat head approvingly https://t.co/7zjEC501Ul,"#1 Source for Professional Dog Ratings | STORE: @ShopWeRateDogs | IG, FB & SC: WeRateDogs MOBILE APP: @GoodDogsGame | Business: dogratingtwitter@gmail.com",https://t.co/7zjEC501Ul,https://twitter.com/dog_rates/status/712438159032893441/photo/1
712309440758808576,114031,26,"Reminder that we made our first set of stickers available! All are 12/10 would stick
Use code ""pupper"" at checkoutðŸ¶

https://t.co/kJIMNyMNKV","#1 Source for Professional Dog Ratings | STORE: @ShopWeRateDogs | IG, FB & SC: WeRateDogs MOBILE APP: @GoodDogsGame | Business: dogratingtwitter@gmail.com",NaN,NaN
712097430750289920,114031,1172,I can't even comprehend how confused this dog must be right now. 10/10 https://t.co/8AGcQ4hIfK,"#1 Source for Professional Dog Ratings | STORE: @ShopWeRateDogs | IG, FB & SC: WeRateDogs MOBILE APP: @GoodDogsGame | Business: dogratingtwitter@gmail.com",https://t.co/8AGcQ4hIfK,https://twitter.com/dog_rates/status/712097430750289920/photo/1
712092745624633345,114031,1016,This is Steven. He's inverted af. Also very helpful. Scans anything you want for free. Takes him a while tho. 7/10 https://t.co/tA0ZiQ7JcG,"#1 Source for Professional Dog Ratings | STORE: @ShopWeRateDogs | IG, FB & SC: WeRateDogs MOBILE APP: @GoodDogsGame | Business: dogratingtwitter@gmail.com",https://t.co/tA0ZiQ7JcG,https://twitter.com/dog_rates/status/712092745624633345/photo/1
712085617388212225,114031,556,"Say hello to Olive and Ruby. They are best buddies. Both 11/10 
1 like = 1 buddy https://t.co/yagmFdKlyL","#1 Source for Professional Dog Ratings | STORE: @ShopWeRateDogs | IG, FB & SC: WeRateDogs MOBILE APP: @GoodDogsGame | Business: dogratingtwitter@gmail.com",https://t.co/yagmFdKlyL,https://twitter.com/dog_rates/status/712085617388212225/photo/1
712065007010385924,114031,700,This is Chester. He's clearly in charge of the other dogs. Weird ass paws. Not fit for fetch. 6/10 would still pet https://t.co/o2GvskrhHt,"#1 Source for Professional Dog Ratings | STORE: @ShopWeRateDogs | IG, FB & SC: WeRateDogs MOBILE APP: @GoodDogsGame | Business: dogratingtwitter@gmail.com",https://t.co/o2GvskrhHt,https://twitter.com/dog_rates/status/712065007010385924/photo/1
711998809858043904,114031,138,RT @twitter: @dog_rates Awesome Tweet! 12/10. Would Retweet. #LoveTwitter https://t.co/j6FQGhxYuN,"#1 Source for Professional Dog Ratings | STORE: @ShopWeRateDogs | IG, FB & SC: WeRateDogs MOBILE APP: @GoodDogsGame | Business: dogratingtwitter@gmail.com",https://t.co/j6FQGhxYuN,https://twitter.com/twitter/status/711998279773347841/photo/1
711968124745228288,114031,2601,Meet Winston. He's trapped in a cup of coffee. Poor pupper. 10/10 someone free him https://t.co/2e6cUtKUuc,"#1 Source for Professional Dog Ratings | STORE: @ShopWeRateDogs | IG, FB & SC: WeRateDogs MOBILE APP: @GoodDogsGame | Business: dogratingtwitter@gmail.com",https://t.co/2e6cUtKUuc,https://twitter.com/dog_rates/status/711968124745228288/photo/1
711743778164514816,114031,1101,Meet Roosevelt. He's calculating the best case scenario if he drops out instead of doing math hw. 11/10 relatable af https://t.co/QcSIRDpfVg,"#1 Source for Professional Dog Ratings | STORE: @ShopWeRateDogs | IG, FB & SC: WeRateDogs MOBILE APP: @GoodDogsGame | Business: dogratingtwitter@gmail.com",https://t.co/QcSIRDpfVg,https://twitter.com/dog_rates/status/711743778164514816/photo/1
711732680602345472,114031,4653,I want to hear the joke this dog was just told. 10/10 https://t.co/1KiuZqqOD4,"#1 Source for Professional Dog Ratings | STORE: @ShopWeRateDogs | IG, FB & SC: WeRateDogs MOBILE APP: @GoodDogsGame | Business: dogratingtwitter@gmail.com",https://t.co/1KiuZqqOD4,https://twitter.com/dog_rates/status/711732680602345472/photo/1
711694788429553666,114031,20500,Oh. My. God. 13/10 magical af https://t.co/Ezu6jQrKAZ,"#1 Source for Professional Dog Ratings | STORE: @ShopWeRateDogs | IG, FB & SC: WeRateDogs MOBILE APP: @GoodDogsGame | Business: dogratingtwitter@gmail.com",https://t.co/Ezu6jQrKAZ,https://twitter.com/dog_rates/status/711694788429553666/photo/1
711652651650457602,114031,1037,This is Gary. He just wanted to say hi. 9/10 very personable pup https://t.co/Sk3CbhmKSW,"#1 Source for Professional Dog Ratings | STORE: @ShopWeRateDogs | IG, FB & SC: WeRateDogs MOBILE APP: @GoodDogsGame | Business: dogratingtwitter@gmail.com",https://t.co/Sk3CbhmKSW,https://twitter.com/dog_rates/status/711652651650457602/photo/1
711363825979756544,114031,1287,"""Please, no puparazzi"" 11/10 https://t.co/nJIXSPfedK","#1 Source for Professional Dog Ratings | STORE: @ShopWeRateDogs | IG, FB & SC: WeRateDogs MOBILE APP: @GoodDogsGame | Business: dogratingtwitter@gmail.com",https://t.co/nJIXSPfedK,https://twitter.com/dog_rates/status/711363825979756544/photo/1
711306686208872448,114031,819,What hooligan sent in pictures w/out a dog in them? Churlish af. 3/10 just bc that's a neat fluffy bean bag chair https://t.co/wcwoGOkZvz,"#1 Source for Professional Dog Ratings | STORE: @ShopWeRateDogs | IG, FB & SC: WeRateDogs MOBILE APP: @GoodDogsGame | Business: dogratingtwitter@gmail.com",https://t.co/wcwoGOkZvz,https://twitter.com/dog_rates/status/711306686208872448/photo/1
711008018775851008,114031,710,This is Chuckles. He had a balloon but he accidentally let go of it and it floated away. 11/10 hang in there pupper https://t.co/68iNM7B5gW,"#1 Source for Professional Dog Ratings | STORE: @ShopWeRateDogs | IG, FB & SC: WeRateDogs MOBILE APP: @GoodDogsGame | Business: dogratingtwitter@gmail.com",https://t.co/68iNM7B5gW,https://twitter.com/dog_rates/status/711008018775851008/photo/1
710997087345876993,114031,1561,Meet Milo and Amos. They are the best of pals. Both 12/10 would pet at the same time https://t.co/Mv37BHEyyD,"#1 Source for Professional Dog Ratings | STORE: @ShopWeRateDogs | IG, FB & SC: WeRateDogs MOBILE APP: @GoodDogsGame | Business: dogratingtwitter@gmail.com",https://t.co/Mv37BHEyyD,https://twitter.com/dog_rates/status/710997087345876993/photo/1
710844581445812225,114031,779,This is Staniel. His selfie game is strong af. 10/10 I'd snapchat with Staniel https://t.co/UgkTw7TKyM,"#1 Source for Professional Dog Ratings | STORE: @ShopWeRateDogs | IG, FB & SC: WeRateDogs MOBILE APP: @GoodDogsGame | Business: dogratingtwitter@gmail.com",https://t.co/UgkTw7TKyM,https://twitter.com/dog_rates/status/710844581445812225/photo/1
710833117892898816,114031,606,Say hello to Sora. She's an Egyptian Pumpernickel. Mesmerizing af. 12/10 would bring home to mom https://t.co/PmTR4kxZkq,"#1 Source for Professional Dog Ratings | STORE: @ShopWeRateDogs | IG, FB & SC: WeRateDogs MOBILE APP: @GoodDogsGame | Business: dogratingtwitter@gmail.com",https://t.co/PmTR4kxZkq,https://twitter.com/dog_rates/status/710833117892898816/photo/1
710658690886586372,114031,636,Here's a brigade of puppers. All look very prepared for whatever happens next. 80/80 https://t.co/0eb7R1Om12,"#1 Source for Professional Dog Ratings | STORE: @ShopWeRateDogs | IG, FB & SC: WeRateDogs MOBILE APP: @GoodDogsGame | Business: dogratingtwitter@gmail.com",https://t.co/0eb7R1Om12,https://twitter.com/dog_rates/status/710658690886586372/photo/1
710609963652087808,114031,2624,I've watched this a million times and you probably will too. 12/10 (vid by @emily_galasso) https://t.co/DU7Rb3NDiy,"#1 Source for Professional Dog Ratings | STORE: @ShopWeRateDogs | IG, FB & SC: WeRateDogs MOBILE APP: @GoodDogsGame | Business: dogratingtwitter@gmail.com",NaN,NaN
710588934686908417,114031,2107,This is Beemo. He's a Chubberflop mix. 12/10 would cross the world for https://t.co/kzMVMU8HBV,"#1 Source for Professional Dog Ratings | STORE: @ShopWeRateDogs | IG, FB & SC: WeRateDogs MOBILE APP: @GoodDogsGame | Business: dogratingtwitter@gmail.com",https://t.co/kzMVMU8HBV,https://twitter.com/dog_rates/status/710588934686908417/photo/1
710296729921429505,114031,833,This is Oshie. 12/10 please enjoy (vid by @catherinec1389) https://t.co/VmtzwAuotq,"#1 Source for Professional Dog Ratings | STORE: @ShopWeRateDogs | IG, FB & SC: WeRateDogs MOBILE APP: @GoodDogsGame | Business: dogratingtwitter@gmail.com",NaN,NaN
710283270106132480,114031,580,This is Gunner. He's a Figamus Newton. King of the peek-a-boo. Cool jeans. 11/10 https://t.co/ONuBILIYXZ,"#1 Source for Professional Dog Ratings | STORE: @ShopWeRateDogs | IG, FB & SC: WeRateDogs MOBILE APP: @GoodDogsGame | Business: dogratingtwitter@gmail.com",https://t.co/ONuBILIYXZ,https://twitter.com/dog_rates/status/710283270106132480/photo/1
710272297844797440,114031,1425,We ðŸ‘ðŸ» only ðŸ‘ðŸ» rate ðŸ‘ðŸ» dogs. Pls stop sending in non-canines like this Dutch Panda Worm. This is infuriating. 11/10 https://t.co/odfLzBonG2,"#1 Source for Professional Dog Ratings | STORE: @ShopWeRateDogs | IG, FB & SC: WeRateDogs MOBILE APP: @GoodDogsGame | Business: dogratingtwitter@gmail.com",https://t.co/odfLzBonG2,https://twitter.com/dog_rates/status/710272297844797440/photo/1
