id,favourites_count,retweet_count,full_text,description,t_link,expanded_url
799422933579902976,114031,2213,This is Longfellow (prolly sophisticated). He's a North Appalachian Oatzenjammer. Concerned about wrinkled feets. 12/10 would hug softly https://t.co/bpLuQuxzHZ,"#1 Source for Professional Dog Ratings | STORE: @ShopWeRateDogs | IG, FB & SC: WeRateDogs MOBILE APP: @GoodDogsGame | Business: dogratingtwitter@gmail.com",https://t.co/bpLuQuxzHZ,https://twitter.com/dog_rates/status/799422933579902976/photo/1
799308762079035393,114031,6478,RT @dog_rates: I WAS SENT THE ACTUAL DOG IN THE PROFILE PIC BY HIS OWNER THIS IS SO WILD. 14/10 ULTIMATE LEGEND STATUS https://t.co/7oQ1wpfâ€¦,"#1 Source for Professional Dog Ratings | STORE: @ShopWeRateDogs | IG, FB & SC: WeRateDogs MOBILE APP: @GoodDogsGame | Business: dogratingtwitter@gmail.com",NaN,NaN
799297110730567681,114031,3227,This is Jeffrey. He's quite the jokester. Takes it too far sometimes. Still 11/10 would pet https://t.co/YDtZcAiMAf,"#1 Source for Professional Dog Ratings | STORE: @ShopWeRateDogs | IG, FB & SC: WeRateDogs MOBILE APP: @GoodDogsGame | Business: dogratingtwitter@gmail.com",https://t.co/YDtZcAiMAf,https://twitter.com/dog_rates/status/799297110730567681/photo/1
799063482566066176,114031,2863,This is Mister. He only wears the most fashionable af headwear. 11/10 h*ckin stylish https://t.co/BXJFKOVnJm,"#1 Source for Professional Dog Ratings | STORE: @ShopWeRateDogs | IG, FB & SC: WeRateDogs MOBILE APP: @GoodDogsGame | Business: dogratingtwitter@gmail.com",https://t.co/BXJFKOVnJm,https://twitter.com/dog_rates/status/799063482566066176/photo/1
798933969379225600,114031,5203,This is Iroh. He's in a predicament. 12/10 someone help him https://t.co/KJAKO2kXsL,"#1 Source for Professional Dog Ratings | STORE: @ShopWeRateDogs | IG, FB & SC: WeRateDogs MOBILE APP: @GoodDogsGame | Business: dogratingtwitter@gmail.com",https://t.co/KJAKO2kXsL,https://twitter.com/dog_rates/status/798933969379225600/photo/1
798925684722855936,114031,1663,This is Shadow. He's a firm believer that they're all good dogs. H*ckin passionate about it too. 11/10 I stand with Shadow https://t.co/8yvpacwBcu,"#1 Source for Professional Dog Ratings | STORE: @ShopWeRateDogs | IG, FB & SC: WeRateDogs MOBILE APP: @GoodDogsGame | Business: dogratingtwitter@gmail.com",https://t.co/8yvpacwBcu,https://twitter.com/dog_rates/status/798925684722855936/photo/1
798705661114773508,114031,7724,"RT @dog_rates: Meet Baloo. He's expecting a fast ground ball, hence the wide stance. Prepared af. 11/10 nothing runs like a pupper https://â€¦","#1 Source for Professional Dog Ratings | STORE: @ShopWeRateDogs | IG, FB & SC: WeRateDogs MOBILE APP: @GoodDogsGame | Business: dogratingtwitter@gmail.com",NaN,NaN
798701998996647937,114031,9126,RT @dog_rates: We normally don't rate marshmallows but this one appears to be flawlessly toasted so I'll make an exception. 10/10 https://tâ€¦,"#1 Source for Professional Dog Ratings | STORE: @ShopWeRateDogs | IG, FB & SC: WeRateDogs MOBILE APP: @GoodDogsGame | Business: dogratingtwitter@gmail.com",NaN,NaN
798697898615730177,114031,7602,RT @dog_rates: This is Stubert. He just arrived. 10/10 https://t.co/HVGs5aAKAn,"#1 Source for Professional Dog Ratings | STORE: @ShopWeRateDogs | IG, FB & SC: WeRateDogs MOBILE APP: @GoodDogsGame | Business: dogratingtwitter@gmail.com",https://t.co/HVGs5aAKAn,https://twitter.com/dog_rates/status/712809025985978368/photo/1
798694562394996736,114031,5812,"RT @dog_rates: I'm not sure what's happening here, but it's pretty spectacular. 12/10 for both https://t.co/JKXh0NbBNL","#1 Source for Professional Dog Ratings | STORE: @ShopWeRateDogs | IG, FB & SC: WeRateDogs MOBILE APP: @GoodDogsGame | Business: dogratingtwitter@gmail.com",https://t.co/JKXh0NbBNL,https://twitter.com/dog_rates/status/701214700881756160/photo/1
798686750113755136,114031,2702,"RT @dog_rates: Say hello to Jack (pronounced ""Kevin""). He's a Virgo Episcopalian. Can summon rainbows. 11/10 magical as hell https://t.co/Yâ€¦","#1 Source for Professional Dog Ratings | STORE: @ShopWeRateDogs | IG, FB & SC: WeRateDogs MOBILE APP: @GoodDogsGame | Business: dogratingtwitter@gmail.com",NaN,NaN
798682547630837760,114031,5515,RT @dog_rates: Here we see a rare pouched pupper. Ample storage space. Looks alert. Jumps at random. Kicked open that door. 8/10 https://t.â€¦,"#1 Source for Professional Dog Ratings | STORE: @ShopWeRateDogs | IG, FB & SC: WeRateDogs MOBILE APP: @GoodDogsGame | Business: dogratingtwitter@gmail.com",NaN,NaN
798673117451325440,114031,6485,"RT @dog_rates: I shall call him squishy and he shall be mine, and he shall be my squishy. 13/10 https://t.co/WId5lxNdPH","#1 Source for Professional Dog Ratings | STORE: @ShopWeRateDogs | IG, FB & SC: WeRateDogs MOBILE APP: @GoodDogsGame | Business: dogratingtwitter@gmail.com",https://t.co/WId5lxNdPH,https://twitter.com/dog_rates/status/675501075957489664/photo/1
798665375516884993,114031,4519,RT @dog_rates: This is Lola. She fell asleep on a piece of pizza. 10/10 frighteningly relatable https://t.co/eqmkr2gmPH,"#1 Source for Professional Dog Ratings | STORE: @ShopWeRateDogs | IG, FB & SC: WeRateDogs MOBILE APP: @GoodDogsGame | Business: dogratingtwitter@gmail.com",https://t.co/eqmkr2gmPH,https://twitter.com/dog_rates/status/671896809300709376/photo/1
798644042770751489,114031,2153,RT @dog_rates: This is Paull. He just stubbed his toe. 10/10 deep breaths Paull https://t.co/J5Mqn8VeYq,"#1 Source for Professional Dog Ratings | STORE: @ShopWeRateDogs | IG, FB & SC: WeRateDogs MOBILE APP: @GoodDogsGame | Business: dogratingtwitter@gmail.com",https://t.co/J5Mqn8VeYq,https://twitter.com/dog_rates/status/670444955656130560/photo/1
798628517273620480,114031,2272,RT @dog_rates: This a Norwegian Pewterschmidt named Tickles. Ears for days. 12/10 I care deeply for Tickles https://t.co/0aDF62KVP7,"#1 Source for Professional Dog Ratings | STORE: @ShopWeRateDogs | IG, FB & SC: WeRateDogs MOBILE APP: @GoodDogsGame | Business: dogratingtwitter@gmail.com",https://t.co/0aDF62KVP7,https://twitter.com/dog_rates/status/667509364010450944/photo/1
798585098161549313,114031,6618,RT @dog_rates: This is Timison. He just told an awful joke but is still hanging on to the hope that you'll laugh with him. 10/10 https://t.â€¦,"#1 Source for Professional Dog Ratings | STORE: @ShopWeRateDogs | IG, FB & SC: WeRateDogs MOBILE APP: @GoodDogsGame | Business: dogratingtwitter@gmail.com",NaN,NaN
798576900688019456,114031,6871,RT @dog_rates: Not familiar with this breed. No tail (weird). Only 2 legs. Doesn't bark. Surprisingly quick. Shits eggs. 1/10 https://t.co/â€¦,"#1 Source for Professional Dog Ratings | STORE: @ShopWeRateDogs | IG, FB & SC: WeRateDogs MOBILE APP: @GoodDogsGame | Business: dogratingtwitter@gmail.com",NaN,NaN
798340744599797760,114031,3924,RT @dog_rates: This is Davey. He'll have your daughter home by 8. Just a stand up pup. 11/10 would introduce to mom https://t.co/E6bGWf9EOm,"#1 Source for Professional Dog Ratings | STORE: @ShopWeRateDogs | IG, FB & SC: WeRateDogs MOBILE APP: @GoodDogsGame | Business: dogratingtwitter@gmail.com",https://t.co/E6bGWf9EOm,https://twitter.com/dog_rates/status/771770456517009408/photo/1
798209839306514432,114031,2954,This is Cooper. His bow tie was too heavy for the front so he moved it to the side. Balanced af now. 13/10 https://t.co/jG1PAFkB81,"#1 Source for Professional Dog Ratings | STORE: @ShopWeRateDogs | IG, FB & SC: WeRateDogs MOBILE APP: @GoodDogsGame | Business: dogratingtwitter@gmail.com",https://t.co/jG1PAFkB81,https://twitter.com/dog_rates/status/798209839306514432/photo/1
797971864723324932,114031,3652,Here's a helicopter pupper. He takes off at random. H*ckin hard to control. 12/10 rare af https://t.co/GRWPgNKt2z,"#1 Source for Professional Dog Ratings | STORE: @ShopWeRateDogs | IG, FB & SC: WeRateDogs MOBILE APP: @GoodDogsGame | Business: dogratingtwitter@gmail.com",https://t.co/GRWPgNKt2z,https://twitter.com/dog_rates/status/797971864723324932/photo/1
797545162159308800,114031,5656,This is Cassie. She steals things. Guilt increases slightly each time. 12/10 would forgive almost immediately https://t.co/Ia19irLwyB,"#1 Source for Professional Dog Ratings | STORE: @ShopWeRateDogs | IG, FB & SC: WeRateDogs MOBILE APP: @GoodDogsGame | Business: dogratingtwitter@gmail.com",https://t.co/Ia19irLwyB,https://twitter.com/dog_rates/status/797545162159308800/photo/1
797236660651966464,114031,7726,This is Pancake. She loves Batman and winks like a h*ckin champ. 12/10 real crowd pleaser https://t.co/6kqsAjJNhi,"#1 Source for Professional Dog Ratings | STORE: @ShopWeRateDogs | IG, FB & SC: WeRateDogs MOBILE APP: @GoodDogsGame | Business: dogratingtwitter@gmail.com",https://t.co/6kqsAjJNhi,https://twitter.com/dog_rates/status/797236660651966464/photo/1
797165961484890113,114031,32,@JODYHiGHROLLER it may be an 11/10 but what do I know ðŸ˜‰,"#1 Source for Professional Dog Ratings | STORE: @ShopWeRateDogs | IG, FB & SC: WeRateDogs MOBILE APP: @GoodDogsGame | Business: dogratingtwitter@gmail.com",NaN,NaN
796904159865868288,114031,10411,RT @dog_rates: This is Tyrone. He's a leaf wizard. Self-motivated. No eyes (tragic). Inspirational af. 11/10 enthusiasm is tangible https:/â€¦,"#1 Source for Professional Dog Ratings | STORE: @ShopWeRateDogs | IG, FB & SC: WeRateDogs MOBILE APP: @GoodDogsGame | Business: dogratingtwitter@gmail.com",NaN,NaN
796865951799083009,114031,2198,This is Tyr. He's just checking on you. Nifty af tongue slip. 12/10 would absolutely pet https://t.co/Jgnuiyvq06,"#1 Source for Professional Dog Ratings | STORE: @ShopWeRateDogs | IG, FB & SC: WeRateDogs MOBILE APP: @GoodDogsGame | Business: dogratingtwitter@gmail.com",https://t.co/Jgnuiyvq06,https://twitter.com/dog_rates/status/796865951799083009/photo/1
796759840936919040,114031,3562,Say hello to Romeo. He was just told that it's too cold for the pool. H*ckin nonsense. 11/10 would help fill up https://t.co/6hx7ur6sNI,"#1 Source for Professional Dog Ratings | STORE: @ShopWeRateDogs | IG, FB & SC: WeRateDogs MOBILE APP: @GoodDogsGame | Business: dogratingtwitter@gmail.com",https://t.co/6hx7ur6sNI,https://twitter.com/dog_rates/status/796759840936919040/photo/1
796563435802726400,114031,8536,RT @dog_rates: I want to finally rate this iconic puppo who thinks the parade is all for him. 13/10 would absolutely attend https://t.co/5dâ€¦,"#1 Source for Professional Dog Ratings | STORE: @ShopWeRateDogs | IG, FB & SC: WeRateDogs MOBILE APP: @GoodDogsGame | Business: dogratingtwitter@gmail.com",NaN,NaN
796484825502875648,114031,2042,Here's a sleepy doggo that requested some assistance. 12/10 would carry everywhere https://t.co/bvkkqOjNDV,"#1 Source for Professional Dog Ratings | STORE: @ShopWeRateDogs | IG, FB & SC: WeRateDogs MOBILE APP: @GoodDogsGame | Business: dogratingtwitter@gmail.com",https://t.co/bvkkqOjNDV,https://twitter.com/dog_rates/status/796484825502875648/photo/1
796387464403357696,114031,4861,This is Snicku. He's having trouble reading because he's a dog. Glasses only helped a little. Nap preferred. 12/10 would snug well https://t.co/cVLUasbKA5,"#1 Source for Professional Dog Ratings | STORE: @ShopWeRateDogs | IG, FB & SC: WeRateDogs MOBILE APP: @GoodDogsGame | Business: dogratingtwitter@gmail.com",https://t.co/cVLUasbKA5,https://twitter.com/dog_rates/status/796387464403357696/photo/1
796177847564038144,114031,16628,RT @dog_rates: This is Ruby. She just turned on the news. Officially terrified. 11/10 deep breaths Ruby https://t.co/y5KarNXWXt,"#1 Source for Professional Dog Ratings | STORE: @ShopWeRateDogs | IG, FB & SC: WeRateDogs MOBILE APP: @GoodDogsGame | Business: dogratingtwitter@gmail.com",https://t.co/y5KarNXWXt,https://twitter.com/dog_rates/status/796149749086875649/photo/1
796149749086875649,114031,16628,This is Ruby. She just turned on the news. Officially terrified. 11/10 deep breaths Ruby https://t.co/y5KarNXWXt,"#1 Source for Professional Dog Ratings | STORE: @ShopWeRateDogs | IG, FB & SC: WeRateDogs MOBILE APP: @GoodDogsGame | Business: dogratingtwitter@gmail.com",https://t.co/y5KarNXWXt,https://twitter.com/dog_rates/status/796149749086875649/photo/1
796125600683540480,114031,2079,"#ImWithThor 13/10
https://t.co/a18mzkhTf6","#1 Source for Professional Dog Ratings | STORE: @ShopWeRateDogs | IG, FB & SC: WeRateDogs MOBILE APP: @GoodDogsGame | Business: dogratingtwitter@gmail.com",NaN,NaN
796116448414461957,114031,2813,I didn't believe it at first but now I can see that voter fraud is a serious h*ckin issue. 11/10 https://t.co/7i0bDMbrVN,"#1 Source for Professional Dog Ratings | STORE: @ShopWeRateDogs | IG, FB & SC: WeRateDogs MOBILE APP: @GoodDogsGame | Business: dogratingtwitter@gmail.com",https://t.co/7i0bDMbrVN,https://twitter.com/dog_rates/status/796116448414461957/photo/1
796080075804475393,114031,2703,This is Yogi. He's 98% floof. Snuggable af. 12/10 https://t.co/opoXKxmfFm,"#1 Source for Professional Dog Ratings | STORE: @ShopWeRateDogs | IG, FB & SC: WeRateDogs MOBILE APP: @GoodDogsGame | Business: dogratingtwitter@gmail.com",https://t.co/opoXKxmfFm,https://twitter.com/dog_rates/status/796080075804475393/photo/1
796031486298386433,114031,4284,This is Daisy. She's here to make your day better. 13/10 mission h*ckin successful https://t.co/PbgvuD0qIL,"#1 Source for Professional Dog Ratings | STORE: @ShopWeRateDogs | IG, FB & SC: WeRateDogs MOBILE APP: @GoodDogsGame | Business: dogratingtwitter@gmail.com",https://t.co/PbgvuD0qIL,https://twitter.com/dog_rates/status/796031486298386433/photo/1
795464331001561088,114031,27728,Elder doggo does a splash. Both 13/10 incredible stuff https://t.co/gBUDjdEcqz,"#1 Source for Professional Dog Ratings | STORE: @ShopWeRateDogs | IG, FB & SC: WeRateDogs MOBILE APP: @GoodDogsGame | Business: dogratingtwitter@gmail.com",https://t.co/gBUDjdEcqz,https://twitter.com/dog_rates/status/795464331001561088/video/1
795400264262053889,114031,3323,This is Brody. He's trying to make the same face as the football. 12/10 https://t.co/2H4MfOGlpQ,"#1 Source for Professional Dog Ratings | STORE: @ShopWeRateDogs | IG, FB & SC: WeRateDogs MOBILE APP: @GoodDogsGame | Business: dogratingtwitter@gmail.com",https://t.co/2H4MfOGlpQ,https://twitter.com/dog_rates/status/795400264262053889/photo/1
795076730285391872,114031,6288,This is Bailey. She loves going down slides but is very bad at it. Still 11/10 https://t.co/ivPWhspN3E,"#1 Source for Professional Dog Ratings | STORE: @ShopWeRateDogs | IG, FB & SC: WeRateDogs MOBILE APP: @GoodDogsGame | Business: dogratingtwitter@gmail.com",https://t.co/ivPWhspN3E,https://twitter.com/dog_rates/status/795076730285391872/photo/1
794983741416415232,114031,3942,RT @dog_rates: This is Rizzy. She smiles a lot. 12/10 contagious af https://t.co/TU4sZogVIq,"#1 Source for Professional Dog Ratings | STORE: @ShopWeRateDogs | IG, FB & SC: WeRateDogs MOBILE APP: @GoodDogsGame | Business: dogratingtwitter@gmail.com",https://t.co/TU4sZogVIq,https://twitter.com/dog_rates/status/789530877013393408/photo/1
794926597468000259,114031,2697,This is Mack. He's rather h*ckin sleepy. Exceptional ears. 12/10 would boop https://t.co/XRPvTPF0VH,"#1 Source for Professional Dog Ratings | STORE: @ShopWeRateDogs | IG, FB & SC: WeRateDogs MOBILE APP: @GoodDogsGame | Business: dogratingtwitter@gmail.com",https://t.co/XRPvTPF0VH,https://twitter.com/dog_rates/status/794926597468000259/photo/1
794355576146903043,114031,12014,RT @dog_rates: This is Butter. She can have whatever she wants forever. 12/10 would hug softly https://t.co/x5gXRS1abq,"#1 Source for Professional Dog Ratings | STORE: @ShopWeRateDogs | IG, FB & SC: WeRateDogs MOBILE APP: @GoodDogsGame | Business: dogratingtwitter@gmail.com",https://t.co/x5gXRS1abq,https://twitter.com/dog_rates/status/788765914992902144/photo/1
794332329137291264,114031,3088,This is Nimbus (like the cloud). He just bought this fancy af duck raincoat. Only protects one ear tho. 12/10 so h*ckin floofy https://t.co/SIQbb8c3AU,"#1 Source for Professional Dog Ratings | STORE: @ShopWeRateDogs | IG, FB & SC: WeRateDogs MOBILE APP: @GoodDogsGame | Business: dogratingtwitter@gmail.com",https://t.co/SIQbb8c3AU,https://twitter.com/dog_rates/status/794332329137291264/photo/1
794205286408003585,114031,3895,This is Laika. She was a space pupper. The first space pupper actually. Orbited earth like a h*ckin boss. 14/10 hero af https://t.co/trSjgY3h4g,"#1 Source for Professional Dog Ratings | STORE: @ShopWeRateDogs | IG, FB & SC: WeRateDogs MOBILE APP: @GoodDogsGame | Business: dogratingtwitter@gmail.com",https://t.co/trSjgY3h4g,https://twitter.com/dog_rates/status/794205286408003585/photo/1
793962221541933056,114031,5711,This is Maximus. His face is stuck like that. Tragic really. Great tongue tho. 12/10 would pet firmly https://t.co/xIfrsMNLBR,"#1 Source for Professional Dog Ratings | STORE: @ShopWeRateDogs | IG, FB & SC: WeRateDogs MOBILE APP: @GoodDogsGame | Business: dogratingtwitter@gmail.com",https://t.co/xIfrsMNLBR,https://twitter.com/dog_rates/status/793962221541933056/photo/1
793845145112371200,114031,2187,This is Clark. He was just caught wearing pants. 13/10 game-changing af https://t.co/2Xo19aPrG5,"#1 Source for Professional Dog Ratings | STORE: @ShopWeRateDogs | IG, FB & SC: WeRateDogs MOBILE APP: @GoodDogsGame | Business: dogratingtwitter@gmail.com",https://t.co/2Xo19aPrG5,https://twitter.com/dog_rates/status/793845145112371200/photo/1
793614319594401792,114031,3661,RT @dog_rates: When she says you're a good boy and you know you're a good boy because you're a good boy. 13/10 https://t.co/O5IUmRHRIh,"#1 Source for Professional Dog Ratings | STORE: @ShopWeRateDogs | IG, FB & SC: WeRateDogs MOBILE APP: @GoodDogsGame | Business: dogratingtwitter@gmail.com",https://t.co/O5IUmRHRIh,https://twitter.com/dog_rates/status/791672322847637504/photo/1
793601777308463104,114031,1908,This is Dobby. I can't stop looking at her feet. 12/10 would absolutely snug https://t.co/LhzPWv6rTv,"#1 Source for Professional Dog Ratings | STORE: @ShopWeRateDogs | IG, FB & SC: WeRateDogs MOBILE APP: @GoodDogsGame | Business: dogratingtwitter@gmail.com",https://t.co/LhzPWv6rTv,https://twitter.com/dog_rates/status/793601777308463104/photo/1
793500921481273345,114031,2786,This is Fiona. She's an extremely mediocre copilot. Very distracting. Wink makes up for all the missed turns. 12/10 https://t.co/aF5MmpvPqN,"#1 Source for Professional Dog Ratings | STORE: @ShopWeRateDogs | IG, FB & SC: WeRateDogs MOBILE APP: @GoodDogsGame | Business: dogratingtwitter@gmail.com",https://t.co/aF5MmpvPqN,https://twitter.com/dog_rates/status/793500921481273345/photo/1
793286476301799424,114031,10723,This is Moreton. He's the Good Boy Who Lived. 13/10 magical as h*ck https://t.co/rLHGx3VAF3,"#1 Source for Professional Dog Ratings | STORE: @ShopWeRateDogs | IG, FB & SC: WeRateDogs MOBILE APP: @GoodDogsGame | Business: dogratingtwitter@gmail.com",https://t.co/rLHGx3VAF3,https://twitter.com/dog_rates/status/793286476301799424/photo/1
793271401113350145,114031,2763,Meet Dave. It's his favorite day of the year. He gets to fulfill his dream of being a dinosaur. 12/10 inspirational af https://t.co/MgQSdfZGPN,"#1 Source for Professional Dog Ratings | STORE: @ShopWeRateDogs | IG, FB & SC: WeRateDogs MOBILE APP: @GoodDogsGame | Business: dogratingtwitter@gmail.com",https://t.co/MgQSdfZGPN,https://twitter.com/dog_rates/status/793271401113350145/photo/1
793256262322548741,114031,9714,Oh h*ck look at this spookling right here. Fright level off the charts. 12/10 sufficiently spooked https://t.co/BNy9IIJMb0,"#1 Source for Professional Dog Ratings | STORE: @ShopWeRateDogs | IG, FB & SC: WeRateDogs MOBILE APP: @GoodDogsGame | Business: dogratingtwitter@gmail.com",https://t.co/BNy9IIJMb0,https://twitter.com/dog_rates/status/793256262322548741/photo/1
793241302385262592,114031,3812,This is Tucker. He's out here bustin h*ckin ghosts. 13/10 dedicated af https://t.co/Ap477GhwXt,"#1 Source for Professional Dog Ratings | STORE: @ShopWeRateDogs | IG, FB & SC: WeRateDogs MOBILE APP: @GoodDogsGame | Business: dogratingtwitter@gmail.com",https://t.co/Ap477GhwXt,https://twitter.com/dog_rates/status/793241302385262592/photo/1
793226087023144960,114031,3338,"This is Juno. She spooked me up real good, but only to get my attention. Above average handwriting for a dog I think. 11/10 https://t.co/hFxxBCWlwj","#1 Source for Professional Dog Ratings | STORE: @ShopWeRateDogs | IG, FB & SC: WeRateDogs MOBILE APP: @GoodDogsGame | Business: dogratingtwitter@gmail.com",https://t.co/hFxxBCWlwj,https://twitter.com/dog_rates/status/793226087023144960/photo/1
793210959003287553,114031,3301,This is Maude. She's the h*ckin happiest wasp you've ever seen. 10/10 would pet with caution https://t.co/etL8FHBrh8,"#1 Source for Professional Dog Ratings | STORE: @ShopWeRateDogs | IG, FB & SC: WeRateDogs MOBILE APP: @GoodDogsGame | Business: dogratingtwitter@gmail.com",https://t.co/etL8FHBrh8,https://twitter.com/dog_rates/status/793210959003287553/photo/1
793195938047070209,114031,6547,Say hello to Lily. She's pupset that her costume doesn't fit as well as last year. 12/10 poor puppo https://t.co/YSi6K1firY,"#1 Source for Professional Dog Ratings | STORE: @ShopWeRateDogs | IG, FB & SC: WeRateDogs MOBILE APP: @GoodDogsGame | Business: dogratingtwitter@gmail.com",https://t.co/YSi6K1firY,https://twitter.com/dog_rates/status/793195938047070209/photo/1
793180763617361921,114031,2310,This is Newt. He's a strawberry. 11/10 https://t.co/2VhmlwxA1Q,"#1 Source for Professional Dog Ratings | STORE: @ShopWeRateDogs | IG, FB & SC: WeRateDogs MOBILE APP: @GoodDogsGame | Business: dogratingtwitter@gmail.com",https://t.co/2VhmlwxA1Q,https://twitter.com/dog_rates/status/793180763617361921/photo/1
793165685325201412,114031,3238,This is Benji. He's Air Bud. It's a low effort costume but he pulls it off rather h*ckin well. 12/10 would happily get dunked on https://t.co/IbzT7DJvBo,"#1 Source for Professional Dog Ratings | STORE: @ShopWeRateDogs | IG, FB & SC: WeRateDogs MOBILE APP: @GoodDogsGame | Business: dogratingtwitter@gmail.com",https://t.co/IbzT7DJvBo,https://twitter.com/dog_rates/status/793165685325201412/photo/1
793150605191548928,114031,1984,This is Nida. She's a free elf. Waited so long for this day. 11/10 https://t.co/3lE8Izgmkf,"#1 Source for Professional Dog Ratings | STORE: @ShopWeRateDogs | IG, FB & SC: WeRateDogs MOBILE APP: @GoodDogsGame | Business: dogratingtwitter@gmail.com",https://t.co/3lE8Izgmkf,https://twitter.com/dog_rates/status/793150605191548928/photo/1
793135492858580992,114031,2893,Your favorite squad is looking extra h*ckin spooky today. 13/10 for all https://t.co/PrgvOyPtDT,"#1 Source for Professional Dog Ratings | STORE: @ShopWeRateDogs | IG, FB & SC: WeRateDogs MOBILE APP: @GoodDogsGame | Business: dogratingtwitter@gmail.com",https://t.co/PrgvOyPtDT,https://twitter.com/dog_rates/status/793135492858580992/photo/1
793120401413079041,114031,4551,"This is Robin. She's desperately trying to do me a frighten, but her tongue drastically decreases her spook value. Still 11/10 great effort https://t.co/sxMrsOZ8zb","#1 Source for Professional Dog Ratings | STORE: @ShopWeRateDogs | IG, FB & SC: WeRateDogs MOBILE APP: @GoodDogsGame | Business: dogratingtwitter@gmail.com",https://t.co/sxMrsOZ8zb,https://twitter.com/dog_rates/status/793120401413079041/photo/1
792913359805018113,114031,4715,Here is a perfect example of someone who has their priorities in order. 13/10 for both owner and Forrest https://t.co/LRyMrU7Wfq,"#1 Source for Professional Dog Ratings | STORE: @ShopWeRateDogs | IG, FB & SC: WeRateDogs MOBILE APP: @GoodDogsGame | Business: dogratingtwitter@gmail.com",https://t.co/LRyMrU7Wfq,https://twitter.com/dog_rates/status/792913359805018113/photo/1
792883833364439040,114031,4964,This is Bailey. She's rather h*ckin hype for Halloween tomorrow. Carved those pupkins herself. 12/10 https://t.co/v17mFm0Ftz,"#1 Source for Professional Dog Ratings | STORE: @ShopWeRateDogs | IG, FB & SC: WeRateDogs MOBILE APP: @GoodDogsGame | Business: dogratingtwitter@gmail.com",https://t.co/v17mFm0Ftz,https://twitter.com/dog_rates/status/792883833364439040/photo/1
792773781206999040,114031,1963,This is Monster. Not an actual monster tho. He's showing you his tongue. Very impressive Monster. 12/10 would snug https://t.co/RhaPExuxJL,"#1 Source for Professional Dog Ratings | STORE: @ShopWeRateDogs | IG, FB & SC: WeRateDogs MOBILE APP: @GoodDogsGame | Business: dogratingtwitter@gmail.com",https://t.co/RhaPExuxJL,https://twitter.com/dog_rates/status/792773781206999040/photo/1
792394556390137856,114031,4998,Meet BeBe. She rocks the messy bun of your dreams. H*ckin flawless. 12/10 would watch her tutorial https://t.co/of0pFNBIl8,"#1 Source for Professional Dog Ratings | STORE: @ShopWeRateDogs | IG, FB & SC: WeRateDogs MOBILE APP: @GoodDogsGame | Business: dogratingtwitter@gmail.com",https://t.co/of0pFNBIl8,https://twitter.com/dog_rates/status/792394556390137856/photo/1
792050063153438720,114031,2088,This is Remus. He's a mop that came to life. Can't see anything. Constantly trips over himself. Still a very good dog. 11/10 https://t.co/S3f1SYylzu,"#1 Source for Professional Dog Ratings | STORE: @ShopWeRateDogs | IG, FB & SC: WeRateDogs MOBILE APP: @GoodDogsGame | Business: dogratingtwitter@gmail.com",https://t.co/S3f1SYylzu,https://twitter.com/dog_rates/status/792050063153438720/photo/1
791821351946420224,114031,24514,RT @dog_rates: This little fella really hates stairs. Prefers bush. 13/10 legendary pupper https://t.co/e3LPMAHj7p,"#1 Source for Professional Dog Ratings | STORE: @ShopWeRateDogs | IG, FB & SC: WeRateDogs MOBILE APP: @GoodDogsGame | Business: dogratingtwitter@gmail.com",NaN,NaN
