id,favourites_count,retweet_count,full_text,description,t_link,expanded_url
892420643555336193,114031,8853,This is Phineas. He's a mystical boy. Only ever appears in the hole of a donut. 13/10 https://t.co/MgUWQ76dJU,"#1 Source for Professional Dog Ratings | STORE: @ShopWeRateDogs | IG, FB & SC: WeRateDogs MOBILE APP: @GoodDogsGame | Business: dogratingtwitter@gmail.com",https://t.co/MgUWQ76dJU,https://twitter.com/dog_rates/status/892420643555336193/photo/1
892177421306343426,114031,6514,"This is Tilly. She's just checking pup on you. Hopes you're doing ok. If not, she's available for pats, snugs, boops, the whole bit. 13/10 https://t.co/0Xxu71qeIV","#1 Source for Professional Dog Ratings | STORE: @ShopWeRateDogs | IG, FB & SC: WeRateDogs MOBILE APP: @GoodDogsGame | Business: dogratingtwitter@gmail.com",https://t.co/0Xxu71qeIV,https://twitter.com/dog_rates/status/892177421306343426/photo/1
891815181378084864,114031,4328,This is Archie. He is a rare Norwegian Pouncing Corgo. Lives in the tall grass. You never know when one may strike. 12/10 https://t.co/wUnZnhtVJB,"#1 Source for Professional Dog Ratings | STORE: @ShopWeRateDogs | IG, FB & SC: WeRateDogs MOBILE APP: @GoodDogsGame | Business: dogratingtwitter@gmail.com",https://t.co/wUnZnhtVJB,https://twitter.com/dog_rates/status/891815181378084864/photo/1
891689557279858688,114031,8964,This is Darla. She commenced a snooze mid meal. 13/10 happens to the best of us https://t.co/tD36da7qLQ,"#1 Source for Professional Dog Ratings | STORE: @ShopWeRateDogs | IG, FB & SC: WeRateDogs MOBILE APP: @GoodDogsGame | Business: dogratingtwitter@gmail.com",https://t.co/tD36da7qLQ,https://twitter.com/dog_rates/status/891689557279858688/photo/1
891327558926688256,114031,9774,"This is Franklin. He would like you to stop calling him ""cute."" He is a very fierce shark and should be respected as such. 12/10 #BarkWeek https://t.co/AtUZn91f7f","#1 Source for Professional Dog Ratings | STORE: @ShopWeRateDogs | IG, FB & SC: WeRateDogs MOBILE APP: @GoodDogsGame | Business: dogratingtwitter@gmail.com",https://t.co/AtUZn91f7f,https://twitter.com/dog_rates/status/891327558926688256/photo/1
891087950875897856,114031,3261,Here we have a majestic great white breaching off South Africa's coast. Absolutely h*ckin breathtaking. 13/10 (IG: tucker_marlo) #BarkWeek https://t.co/kQ04fDDRmh,"#1 Source for Professional Dog Ratings | STORE: @ShopWeRateDogs | IG, FB & SC: WeRateDogs MOBILE APP: @GoodDogsGame | Business: dogratingtwitter@gmail.com",https://t.co/kQ04fDDRmh,https://twitter.com/dog_rates/status/891087950875897856/photo/1
890971913173991426,114031,2158,"Meet Jax. He enjoys ice cream so much he gets nervous around it. 13/10 help Jax enjoy more things by clicking below

https://t.co/Zr4hWfAs1H https://t.co/tVJBRMnhxl","#1 Source for Professional Dog Ratings | STORE: @ShopWeRateDogs | IG, FB & SC: WeRateDogs MOBILE APP: @GoodDogsGame | Business: dogratingtwitter@gmail.com",https://t.co/tVJBRMnhxl,https://twitter.com/dog_rates/status/890971913173991426/photo/1
890729181411237888,114031,16716,When you watch your owner call another dog a good boy but then they turn back to you and say you're a great boy. 13/10 https://t.co/v0nONBcwxq,"#1 Source for Professional Dog Ratings | STORE: @ShopWeRateDogs | IG, FB & SC: WeRateDogs MOBILE APP: @GoodDogsGame | Business: dogratingtwitter@gmail.com",https://t.co/v0nONBcwxq,https://twitter.com/dog_rates/status/890729181411237888/photo/1
890609185150312448,114031,4429,This is Zoey. She doesn't want to be one of the scary sharks. Just wants to be a snuggly pettable boatpet. 13/10 #BarkWeek https://t.co/9TwLuAGH0b,"#1 Source for Professional Dog Ratings | STORE: @ShopWeRateDogs | IG, FB & SC: WeRateDogs MOBILE APP: @GoodDogsGame | Business: dogratingtwitter@gmail.com",https://t.co/9TwLuAGH0b,https://twitter.com/dog_rates/status/890609185150312448/photo/1
890240255349198849,114031,7711,This is Cassie. She is a college pup. Studying international doggo communication and stick theory. 14/10 so elegant much sophisticate https://t.co/t1bfwz5S2A,"#1 Source for Professional Dog Ratings | STORE: @ShopWeRateDogs | IG, FB & SC: WeRateDogs MOBILE APP: @GoodDogsGame | Business: dogratingtwitter@gmail.com",https://t.co/t1bfwz5S2A,https://twitter.com/dog_rates/status/890240255349198849/photo/1
890006608113172480,114031,7624,This is Koda. He is a South Australian deckshark. Deceptively deadly. Frighteningly majestic. 13/10 would risk a petting #BarkWeek https://t.co/dVPW0B0Mme,"#1 Source for Professional Dog Ratings | STORE: @ShopWeRateDogs | IG, FB & SC: WeRateDogs MOBILE APP: @GoodDogsGame | Business: dogratingtwitter@gmail.com",https://t.co/dVPW0B0Mme,https://twitter.com/dog_rates/status/890006608113172480/photo/1
889880896479866881,114031,5156,This is Bruno. He is a service shark. Only gets out of the water to assist you. 13/10 terrifyingly good boy https://t.co/u1XPQMl29g,"#1 Source for Professional Dog Ratings | STORE: @ShopWeRateDogs | IG, FB & SC: WeRateDogs MOBILE APP: @GoodDogsGame | Business: dogratingtwitter@gmail.com",https://t.co/u1XPQMl29g,https://twitter.com/dog_rates/status/889880896479866881/photo/1
889665388333682689,114031,8538,Here's a puppo that seems to be on the fence about something haha no but seriously someone help her. 13/10 https://t.co/BxvuXk0UCm,"#1 Source for Professional Dog Ratings | STORE: @ShopWeRateDogs | IG, FB & SC: WeRateDogs MOBILE APP: @GoodDogsGame | Business: dogratingtwitter@gmail.com",https://t.co/BxvuXk0UCm,https://twitter.com/dog_rates/status/889665388333682689/photo/1
889638837579907072,114031,4735,This is Ted. He does his best. Sometimes that's not enough. But it's ok. 12/10 would assist https://t.co/f8dEDcrKSR,"#1 Source for Professional Dog Ratings | STORE: @ShopWeRateDogs | IG, FB & SC: WeRateDogs MOBILE APP: @GoodDogsGame | Business: dogratingtwitter@gmail.com",https://t.co/f8dEDcrKSR,https://twitter.com/dog_rates/status/889638837579907072/photo/1
889531135344209921,114031,2321,This is Stuart. He's sporting his favorite fanny pack. Secretly filled with bones only. 13/10 puppared puppo #BarkWeek https://t.co/y70o6h3isq,"#1 Source for Professional Dog Ratings | STORE: @ShopWeRateDogs | IG, FB & SC: WeRateDogs MOBILE APP: @GoodDogsGame | Business: dogratingtwitter@gmail.com",https://t.co/y70o6h3isq,https://twitter.com/dog_rates/status/889531135344209921/photo/1
889278841981685760,114031,5637,This is Oliver. You're witnessing one of his many brutal attacks. Seems to be playing with his victim. 13/10 fr*ckin frightening #BarkWeek https://t.co/WpHvrQedPb,"#1 Source for Professional Dog Ratings | STORE: @ShopWeRateDogs | IG, FB & SC: WeRateDogs MOBILE APP: @GoodDogsGame | Business: dogratingtwitter@gmail.com",https://t.co/WpHvrQedPb,https://twitter.com/dog_rates/status/889278841981685760/video/1
888917238123831296,114031,4709,This is Jim. He found a fren. Taught him how to sit like the good boys. 12/10 for both https://t.co/chxruIOUJN,"#1 Source for Professional Dog Ratings | STORE: @ShopWeRateDogs | IG, FB & SC: WeRateDogs MOBILE APP: @GoodDogsGame | Business: dogratingtwitter@gmail.com",https://t.co/chxruIOUJN,https://twitter.com/dog_rates/status/888917238123831296/photo/1
888804989199671297,114031,4559,This is Zeke. He has a new stick. Very proud of it. Would like you to throw it for him without taking it. 13/10 would do my best https://t.co/HTQ77yNQ5K,"#1 Source for Professional Dog Ratings | STORE: @ShopWeRateDogs | IG, FB & SC: WeRateDogs MOBILE APP: @GoodDogsGame | Business: dogratingtwitter@gmail.com",https://t.co/HTQ77yNQ5K,https://twitter.com/dog_rates/status/888804989199671297/photo/1
888554962724278272,114031,3732,This is Ralphus. He's powering up. Attempting maximum borkdrive. 13/10 inspirational af https://t.co/YnYAFCTTiK,"#1 Source for Professional Dog Ratings | STORE: @ShopWeRateDogs | IG, FB & SC: WeRateDogs MOBILE APP: @GoodDogsGame | Business: dogratingtwitter@gmail.com",https://t.co/YnYAFCTTiK,https://twitter.com/dog_rates/status/888554962724278272/photo/1
888078434458587136,114031,3653,This is Gerald. He was just told he didn't get the job he interviewed for. A h*ckin injustice. 12/10 didn't want the job anyway https://t.co/DK7iDPfuRX,"#1 Source for Professional Dog Ratings | STORE: @ShopWeRateDogs | IG, FB & SC: WeRateDogs MOBILE APP: @GoodDogsGame | Business: dogratingtwitter@gmail.com",https://t.co/DK7iDPfuRX,https://twitter.com/dog_rates/status/888078434458587136/photo/1
887705289381826560,114031,5609,This is Jeffrey. He has a monopoly on the pool noodles. Currently running a 'boop for two' midweek sale. 13/10 h*ckin strategic https://t.co/PhrUk20Q64,"#1 Source for Professional Dog Ratings | STORE: @ShopWeRateDogs | IG, FB & SC: WeRateDogs MOBILE APP: @GoodDogsGame | Business: dogratingtwitter@gmail.com",https://t.co/PhrUk20Q64,https://twitter.com/dog_rates/status/887705289381826560/photo/1
887517139158093824,114031,12082,I've yet to rate a Venezuelan Hover Wiener. This is such an honor. 14/10 paw-inspiring af (IG: roxy.thedoxy) https://t.co/20VrLAA8ba,"#1 Source for Professional Dog Ratings | STORE: @ShopWeRateDogs | IG, FB & SC: WeRateDogs MOBILE APP: @GoodDogsGame | Business: dogratingtwitter@gmail.com",https://t.co/20VrLAA8ba,https://twitter.com/dog_rates/status/887517139158093824/video/1
887473957103951883,114031,18781,This is Canela. She attempted some fancy porch pics. They were unsuccessful. 13/10 someone help her https://t.co/cLyzpcUcMX,"#1 Source for Professional Dog Ratings | STORE: @ShopWeRateDogs | IG, FB & SC: WeRateDogs MOBILE APP: @GoodDogsGame | Business: dogratingtwitter@gmail.com",https://t.co/cLyzpcUcMX,https://twitter.com/dog_rates/status/887473957103951883/photo/1
887343217045368832,114031,10737,You may not have known you needed to see this today. 13/10 please enjoy (IG: emmylouroo) https://t.co/WZqNqygEyV,"#1 Source for Professional Dog Ratings | STORE: @ShopWeRateDogs | IG, FB & SC: WeRateDogs MOBILE APP: @GoodDogsGame | Business: dogratingtwitter@gmail.com",https://t.co/WZqNqygEyV,https://twitter.com/dog_rates/status/887343217045368832/video/1
887101392804085760,114031,6167,This... is a Jubilant Antarctic House Bear. We only rate dogs. Please only send dogs. Thank you... 12/10 would suffocate in floof https://t.co/4Ad1jzJSdp,"#1 Source for Professional Dog Ratings | STORE: @ShopWeRateDogs | IG, FB & SC: WeRateDogs MOBILE APP: @GoodDogsGame | Business: dogratingtwitter@gmail.com",https://t.co/4Ad1jzJSdp,https://twitter.com/dog_rates/status/887101392804085760/photo/1
886983233522544640,114031,8084,This is Maya. She's very shy. Rarely leaves her cup. 13/10 would find her an environment to thrive in https://t.co/I6oNy0CgiT,"#1 Source for Professional Dog Ratings | STORE: @ShopWeRateDogs | IG, FB & SC: WeRateDogs MOBILE APP: @GoodDogsGame | Business: dogratingtwitter@gmail.com",https://t.co/I6oNy0CgiT,https://twitter.com/dog_rates/status/886983233522544640/photo/1
886736880519319552,114031,3443,"This is Mingus. He's a wonderful father to his smol pup. Confirmed 13/10, but he needs your help

https://t.co/bVi0Yr4Cff https://t.co/ISvKOSkd5b","#1 Source for Professional Dog Ratings | STORE: @ShopWeRateDogs | IG, FB & SC: WeRateDogs MOBILE APP: @GoodDogsGame | Business: dogratingtwitter@gmail.com",https://t.co/ISvKOSkd5b,https://twitter.com/dog_rates/status/886736880519319552/photo/1
886680336477933568,114031,4610,This is Derek. He's late for a dog meeting. 13/10 pet...al to the metal https://t.co/BCoWue0abA,"#1 Source for Professional Dog Ratings | STORE: @ShopWeRateDogs | IG, FB & SC: WeRateDogs MOBILE APP: @GoodDogsGame | Business: dogratingtwitter@gmail.com",https://t.co/BCoWue0abA,https://twitter.com/dog_rates/status/886680336477933568/photo/1
886366144734445568,114031,3316,This is Roscoe. Another pupper fallen victim to spontaneous tongue ejections. Get the BlepiPen immediate. 12/10 deep breaths Roscoe https://t.co/RGE08MIJox,"#1 Source for Professional Dog Ratings | STORE: @ShopWeRateDogs | IG, FB & SC: WeRateDogs MOBILE APP: @GoodDogsGame | Business: dogratingtwitter@gmail.com",https://t.co/RGE08MIJox,https://twitter.com/dog_rates/status/886366144734445568/photo/1
886267009285017600,114031,4,@NonWhiteHat @MayhewMayhem omg hello tanner you are a scary good boy 12/10 would pet with extreme caution,"#1 Source for Professional Dog Ratings | STORE: @ShopWeRateDogs | IG, FB & SC: WeRateDogs MOBILE APP: @GoodDogsGame | Business: dogratingtwitter@gmail.com",NaN,NaN
886258384151887873,114031,6523,This is Waffles. His doggles are pupside down. Unsure how to fix. 13/10 someone assist Waffles https://t.co/xZDA9Qsq1O,"#1 Source for Professional Dog Ratings | STORE: @ShopWeRateDogs | IG, FB & SC: WeRateDogs MOBILE APP: @GoodDogsGame | Business: dogratingtwitter@gmail.com",https://t.co/xZDA9Qsq1O,https://twitter.com/dog_rates/status/886258384151887873/photo/1
886054160059072513,114031,108,RT @Athletics: 12/10 #BATP https://t.co/WxwJmvjfxo,"#1 Source for Professional Dog Ratings | STORE: @ShopWeRateDogs | IG, FB & SC: WeRateDogs MOBILE APP: @GoodDogsGame | Business: dogratingtwitter@gmail.com",NaN,NaN
885984800019947520,114031,7097,Viewer discretion advised. This is Jimbo. He will rip ur finger right h*ckin off. Other dog clearly an accessory. 12/10 pls pet with caution https://t.co/BuveP0uMF1,"#1 Source for Professional Dog Ratings | STORE: @ShopWeRateDogs | IG, FB & SC: WeRateDogs MOBILE APP: @GoodDogsGame | Business: dogratingtwitter@gmail.com",https://t.co/BuveP0uMF1,https://twitter.com/dog_rates/status/885984800019947520/photo/1
885528943205470208,114031,6683,This is Maisey. She fell asleep mid-excavation. Happens to the best of us. 13/10 would pat noggin approvingly https://t.co/tp1kQ8i9JF,"#1 Source for Professional Dog Ratings | STORE: @ShopWeRateDogs | IG, FB & SC: WeRateDogs MOBILE APP: @GoodDogsGame | Business: dogratingtwitter@gmail.com",https://t.co/tp1kQ8i9JF,https://twitter.com/dog_rates/status/885528943205470208/photo/1
885518971528720385,114031,3899,I have a new hero and his name is Howard. 14/10 https://t.co/gzLHboL7Sk,"#1 Source for Professional Dog Ratings | STORE: @ShopWeRateDogs | IG, FB & SC: WeRateDogs MOBILE APP: @GoodDogsGame | Business: dogratingtwitter@gmail.com",NaN,NaN
885311592912609280,114031,19297,RT @dog_rates: This is Lilly. She just parallel barked. Kindly requests a reward now. 13/10 would pet so well https://t.co/SATN4If5H5,"#1 Source for Professional Dog Ratings | STORE: @ShopWeRateDogs | IG, FB & SC: WeRateDogs MOBILE APP: @GoodDogsGame | Business: dogratingtwitter@gmail.com",https://t.co/SATN4If5H5,https://twitter.com/dog_rates/status/830583320585068544/photo/1
885167619883638784,114031,4556,Here we have a corgi undercover as a malamute. Pawbably doing important investigative work. Zero control over tongue happenings. 13/10 https://t.co/44ItaMubBf,"#1 Source for Professional Dog Ratings | STORE: @ShopWeRateDogs | IG, FB & SC: WeRateDogs MOBILE APP: @GoodDogsGame | Business: dogratingtwitter@gmail.com",https://t.co/44ItaMubBf,https://twitter.com/dog_rates/status/885167619883638784/photo/1
884925521741709313,114031,16439,"This is Earl. He found a hat. Nervous about what you think of it. 12/10 it's delightful, Earl https://t.co/MYJvdlNRVa","#1 Source for Professional Dog Ratings | STORE: @ShopWeRateDogs | IG, FB & SC: WeRateDogs MOBILE APP: @GoodDogsGame | Business: dogratingtwitter@gmail.com",https://t.co/MYJvdlNRVa,https://twitter.com/dog_rates/status/884925521741709313/photo/1
884876753390489601,114031,6096,This is Lola. It's her first time outside. Must test the earth and taste the atmosphere. 13/10 you're doing great Lola https://t.co/74TKAUsLkO,"#1 Source for Professional Dog Ratings | STORE: @ShopWeRateDogs | IG, FB & SC: WeRateDogs MOBILE APP: @GoodDogsGame | Business: dogratingtwitter@gmail.com",https://t.co/74TKAUsLkO,https://twitter.com/dog_rates/status/884876753390489601/photo/1
884562892145688576,114031,5100,This is Kevin. He's just so happy. 13/10 what is your secret Kevin https://t.co/1r4MFCbCX5,"#1 Source for Professional Dog Ratings | STORE: @ShopWeRateDogs | IG, FB & SC: WeRateDogs MOBILE APP: @GoodDogsGame | Business: dogratingtwitter@gmail.com",https://t.co/1r4MFCbCX5,https://twitter.com/dog_rates/status/884562892145688576/photo/1
884441805382717440,114031,5856,"I present to you, Pup in Hat. Pup in Hat is great for all occasions. Extremely versatile. Compact as h*ck. 14/10 (IG: itselizabethgales) https://t.co/vvBOcC2VdC","#1 Source for Professional Dog Ratings | STORE: @ShopWeRateDogs | IG, FB & SC: WeRateDogs MOBILE APP: @GoodDogsGame | Business: dogratingtwitter@gmail.com",https://t.co/vvBOcC2VdC,https://twitter.com/dog_rates/status/884441805382717440/photo/1
884247878851493888,114031,21298,OMG HE DIDN'T MEAN TO HE WAS JUST TRYING A LITTLE BARKOUR HE'S SUPER SORRY 13/10 WOULD FORGIVE IMMEDIATE https://t.co/uF3pQ8Wubj,"#1 Source for Professional Dog Ratings | STORE: @ShopWeRateDogs | IG, FB & SC: WeRateDogs MOBILE APP: @GoodDogsGame | Business: dogratingtwitter@gmail.com",NaN,NaN
884162670584377345,114031,3128,Meet Yogi. He doesn't have any important dog meetings today he just enjoys looking his best at all times. 12/10 for dangerously dapper doggo https://t.co/YSI00BzTBZ,"#1 Source for Professional Dog Ratings | STORE: @ShopWeRateDogs | IG, FB & SC: WeRateDogs MOBILE APP: @GoodDogsGame | Business: dogratingtwitter@gmail.com",https://t.co/YSI00BzTBZ,https://twitter.com/dog_rates/status/884162670584377345/photo/1
883838122936631299,114031,3586,This is Noah. He can't believe someone made this mess. Got the vacuum out for you though. Offered to help clean pup. 12/10 super good boy https://t.co/V85xujjDDY,"#1 Source for Professional Dog Ratings | STORE: @ShopWeRateDogs | IG, FB & SC: WeRateDogs MOBILE APP: @GoodDogsGame | Business: dogratingtwitter@gmail.com",https://t.co/V85xujjDDY,https://twitter.com/dog_rates/status/883838122936631299/photo/1
883482846933004288,114031,10407,"This is Bella. She hopes her smile made you smile. If not, she is also offering you her favorite monkey. 13.5/10 https://t.co/qjrljjt948","#1 Source for Professional Dog Ratings | STORE: @ShopWeRateDogs | IG, FB & SC: WeRateDogs MOBILE APP: @GoodDogsGame | Business: dogratingtwitter@gmail.com",https://t.co/qjrljjt948,https://twitter.com/dog_rates/status/883482846933004288/photo/1
883360690899218434,114031,3825,Meet Grizzwald. He may be the floofiest floofer I ever did see. Lost eyes saving a schoolbus from a volcano erpuption. 13/10 heroic as h*ck https://t.co/rf661IFEYP,"#1 Source for Professional Dog Ratings | STORE: @ShopWeRateDogs | IG, FB & SC: WeRateDogs MOBILE APP: @GoodDogsGame | Business: dogratingtwitter@gmail.com",https://t.co/rf661IFEYP,https://twitter.com/dog_rates/status/883360690899218434/photo/1
883117836046086144,114031,6949,"Please only send dogs. We don't rate mechanics, no matter how h*ckin good. Thank you... 13/10 would sneak a pat https://t.co/Se5fZ9wp5E","#1 Source for Professional Dog Ratings | STORE: @ShopWeRateDogs | IG, FB & SC: WeRateDogs MOBILE APP: @GoodDogsGame | Business: dogratingtwitter@gmail.com",https://t.co/Se5fZ9wp5E,https://twitter.com/dog_rates/status/883117836046086144/photo/1
882992080364220416,114031,4122,This is Rusty. He wasn't ready for the first pic. Clearly puppared for the second. 13/10 confirmed great boy https://t.co/tyER0KpdXj,"#1 Source for Professional Dog Ratings | STORE: @ShopWeRateDogs | IG, FB & SC: WeRateDogs MOBILE APP: @GoodDogsGame | Business: dogratingtwitter@gmail.com",https://t.co/tyER0KpdXj,https://twitter.com/dog_rates/status/882992080364220416/photo/1
882762694511734784,114031,5134,This is Gus. He's quite the cheeky pupper. Already perfected the disinterested wink. 12/10 would let steal my girl https://t.co/D43I96SlVu,"#1 Source for Professional Dog Ratings | STORE: @ShopWeRateDogs | IG, FB & SC: WeRateDogs MOBILE APP: @GoodDogsGame | Business: dogratingtwitter@gmail.com",https://t.co/D43I96SlVu,https://twitter.com/dog_rates/status/882762694511734784/photo/1
882627270321602560,114031,6342,This is Stanley. He has his first swim lesson today. Doggle straps adjusted. Ready to go. 13/10 Phelps is nervous (IG: stanleythe_corgi) https://t.co/Nx52PGwH94,"#1 Source for Professional Dog Ratings | STORE: @ShopWeRateDogs | IG, FB & SC: WeRateDogs MOBILE APP: @GoodDogsGame | Business: dogratingtwitter@gmail.com",https://t.co/Nx52PGwH94,https://twitter.com/dog_rates/status/882627270321602560/photo/1
882268110199369728,114031,12118,This is Alfy. You're witnessing his first watermelon experience. I think it was a success. 13/10 happy 4th Alfy ðŸ‡ºðŸ‡¸ https://t.co/fYP5RlutfA,"#1 Source for Professional Dog Ratings | STORE: @ShopWeRateDogs | IG, FB & SC: WeRateDogs MOBILE APP: @GoodDogsGame | Business: dogratingtwitter@gmail.com",https://t.co/fYP5RlutfA,https://twitter.com/dog_rates/status/882268110199369728/photo/1
882045870035918850,114031,5203,"This is Koko. Her owner, inspired by Barney, recently built a cart for her to use during walks if she got tired. 13/10 rest easy Koko https://t.co/zeDpnsKX7w","#1 Source for Professional Dog Ratings | STORE: @ShopWeRateDogs | IG, FB & SC: WeRateDogs MOBILE APP: @GoodDogsGame | Business: dogratingtwitter@gmail.com",https://t.co/zeDpnsKX7w,https://twitter.com/dog_rates/status/882045870035918850/photo/1
881906580714921986,114031,3533,This is Rey. He's a Benebop Cumberfloof. 12/10 dangerously pettable https://t.co/503CgWbhxQ,"#1 Source for Professional Dog Ratings | STORE: @ShopWeRateDogs | IG, FB & SC: WeRateDogs MOBILE APP: @GoodDogsGame | Business: dogratingtwitter@gmail.com",https://t.co/503CgWbhxQ,https://twitter.com/dog_rates/status/881906580714921986/photo/1
881666595344535552,114031,11099,This is Gary. He couldn't miss this puppertunity for a selfie. Flawless focusing skills. 13/10 would boop intensely https://t.co/7CSWCl8I6s,"#1 Source for Professional Dog Ratings | STORE: @ShopWeRateDogs | IG, FB & SC: WeRateDogs MOBILE APP: @GoodDogsGame | Business: dogratingtwitter@gmail.com",https://t.co/7CSWCl8I6s,https://twitter.com/dog_rates/status/881666595344535552/photo/1
881633300179243008,114031,7,@roushfenway These are good dogs but 17/10 is an emotional impulse rating. More like 13/10s,"#1 Source for Professional Dog Ratings | STORE: @ShopWeRateDogs | IG, FB & SC: WeRateDogs MOBILE APP: @GoodDogsGame | Business: dogratingtwitter@gmail.com",NaN,NaN
881536004380872706,114031,16570,"Here is a pupper approaching maximum borkdrive. Zooming at never before seen speeds. 14/10 paw-inspiring af 
(IG: puffie_the_chow) https://t.co/ghXBIIeQZF","#1 Source for Professional Dog Ratings | STORE: @ShopWeRateDogs | IG, FB & SC: WeRateDogs MOBILE APP: @GoodDogsGame | Business: dogratingtwitter@gmail.com",https://t.co/ghXBIIeQZF,https://twitter.com/dog_rates/status/881536004380872706/video/1
881268444196462592,114031,5358,Meet Elliot. He's a Canadian Forrest Pup. Unusual number of antlers for a dog. Sneaky tongue slip to celebrate #Canada150. 12/10 would pet https://t.co/cgwJwowTMC,"#1 Source for Professional Dog Ratings | STORE: @ShopWeRateDogs | IG, FB & SC: WeRateDogs MOBILE APP: @GoodDogsGame | Business: dogratingtwitter@gmail.com",https://t.co/cgwJwowTMC,https://twitter.com/dog_rates/status/881268444196462592/photo/1
880935762899988482,114031,2886,This is Louis. He's crossing. It's a big deal. 13/10 h*ckin breathtaking https://t.co/D0wb1GlKAt,"#1 Source for Professional Dog Ratings | STORE: @ShopWeRateDogs | IG, FB & SC: WeRateDogs MOBILE APP: @GoodDogsGame | Business: dogratingtwitter@gmail.com",https://t.co/D0wb1GlKAt,https://twitter.com/dog_rates/status/880935762899988482/photo/1
880872448815771648,114031,3989,Ugh not again. We only rate dogs. Please don't send in well-dressed  floppy-tongued street penguins. Dogs only please. Thank you... 12/10 https://t.co/WiAMbTkDPf,"#1 Source for Professional Dog Ratings | STORE: @ShopWeRateDogs | IG, FB & SC: WeRateDogs MOBILE APP: @GoodDogsGame | Business: dogratingtwitter@gmail.com",https://t.co/WiAMbTkDPf,https://twitter.com/dog_rates/status/880872448815771648/photo/1
880465832366813184,114031,6546,This is Bella. She had her first beach experience this morning. Complete success. 12/10 would perform a sandy boop https://t.co/4VsFysDmiw,"#1 Source for Professional Dog Ratings | STORE: @ShopWeRateDogs | IG, FB & SC: WeRateDogs MOBILE APP: @GoodDogsGame | Business: dogratingtwitter@gmail.com",https://t.co/4VsFysDmiw,https://twitter.com/dog_rates/status/880465832366813184/photo/1
880221127280381952,114031,4436,Meet Jesse. He's a Fetty Woof. His tongue ejects without warning. A true bleptomaniac. 12/10 would snug well https://t.co/fUod0tVmvK,"#1 Source for Professional Dog Ratings | STORE: @ShopWeRateDogs | IG, FB & SC: WeRateDogs MOBILE APP: @GoodDogsGame | Business: dogratingtwitter@gmail.com",https://t.co/fUod0tVmvK,https://twitter.com/dog_rates/status/880221127280381952/photo/1
880095782870896641,114031,4533,Please don't send in photos without dogs in them. We're not @porch_rates. Insubordinate and churlish. Pretty good porch tho 11/10 https://t.co/HauE8M3Bu4,"#1 Source for Professional Dog Ratings | STORE: @ShopWeRateDogs | IG, FB & SC: WeRateDogs MOBILE APP: @GoodDogsGame | Business: dogratingtwitter@gmail.com",https://t.co/HauE8M3Bu4,https://twitter.com/dog_rates/status/880095782870896641/photo/1
879862464715927552,114031,3642,This is Romeo. He would like to do an entrance. Requesting your immediate assistance. 13/10 https://t.co/Qh5aEkRQm9,"#1 Source for Professional Dog Ratings | STORE: @ShopWeRateDogs | IG, FB & SC: WeRateDogs MOBILE APP: @GoodDogsGame | Business: dogratingtwitter@gmail.com",https://t.co/Qh5aEkRQm9,https://twitter.com/dog_rates/status/879862464715927552/photo/1
879674319642796034,114031,10,@RealKentMurphy 14/10 confirmed,"#1 Source for Professional Dog Ratings | STORE: @ShopWeRateDogs | IG, FB & SC: WeRateDogs MOBILE APP: @GoodDogsGame | Business: dogratingtwitter@gmail.com",NaN,NaN
