id,favourites_count,retweet_count,full_text,description,t_link,expanded_url
679877062409191424,114031,726,Meet Penelope. She's a bacon frise. Total babe (lol get it like the movie). Doesn't bark tho. 5/10 very average dog https://t.co/SDcQYg0HSZ,"#1 Source for Professional Dog Ratings | STORE: @ShopWeRateDogs | IG, FB & SC: WeRateDogs MOBILE APP: @GoodDogsGame | Business: dogratingtwitter@gmail.com",https://t.co/SDcQYg0HSZ,https://twitter.com/dog_rates/status/679877062409191424/photo/1
679872969355714560,114031,749,This is Rocco. He's in a very intense game of freeze tag. Currently waiting to be unfrozen 10/10 https://t.co/xZXUKVXJ7l,"#1 Source for Professional Dog Ratings | STORE: @ShopWeRateDogs | IG, FB & SC: WeRateDogs MOBILE APP: @GoodDogsGame | Business: dogratingtwitter@gmail.com",NaN,NaN
679862121895714818,114031,706,"""Dammit hooman I'm jus trynna lik the fler"" 11/10 https://t.co/eRZRI8OTj7","#1 Source for Professional Dog Ratings | STORE: @ShopWeRateDogs | IG, FB & SC: WeRateDogs MOBILE APP: @GoodDogsGame | Business: dogratingtwitter@gmail.com",https://t.co/eRZRI8OTj7,https://twitter.com/dog_rates/status/679862121895714818/photo/1
679854723806179328,114031,1402,This is Bruce. He's a rare pup. Covered in Frosted Flakes. Nifty gold teeth. Overall good dog. 7/10 would pet firmly https://t.co/RtxxACzZ8A,"#1 Source for Professional Dog Ratings | STORE: @ShopWeRateDogs | IG, FB & SC: WeRateDogs MOBILE APP: @GoodDogsGame | Business: dogratingtwitter@gmail.com",https://t.co/RtxxACzZ8A,https://twitter.com/dog_rates/status/679854723806179328/photo/1
679844490799091713,114031,887,This is Willie. He's floating away and needs your assistance. Please someone help Willie. 10/10 https://t.co/MJqygWqt8X,"#1 Source for Professional Dog Ratings | STORE: @ShopWeRateDogs | IG, FB & SC: WeRateDogs MOBILE APP: @GoodDogsGame | Business: dogratingtwitter@gmail.com",https://t.co/MJqygWqt8X,https://twitter.com/dog_rates/status/679844490799091713/photo/1
679828447187857408,114031,15839,Everybody look at this beautiful pupper 13/10 https://t.co/hyAC5Hq9GC,"#1 Source for Professional Dog Ratings | STORE: @ShopWeRateDogs | IG, FB & SC: WeRateDogs MOBILE APP: @GoodDogsGame | Business: dogratingtwitter@gmail.com",https://t.co/hyAC5Hq9GC,https://twitter.com/dog_rates/status/679828447187857408/photo/1
679777920601223168,114031,1281,This is Rinna. She's melting. 10/10 get inside pupper https://t.co/PA0czwucsb,"#1 Source for Professional Dog Ratings | STORE: @ShopWeRateDogs | IG, FB & SC: WeRateDogs MOBILE APP: @GoodDogsGame | Business: dogratingtwitter@gmail.com",https://t.co/PA0czwucsb,https://twitter.com/dog_rates/status/679777920601223168/photo/1
679736210798047232,114031,918,This pup's name is Sabertooth (parents must be cool). Ears for days. Jumps unannounced. 9/10 would pet diligently https://t.co/iazoiNUviP,"#1 Source for Professional Dog Ratings | STORE: @ShopWeRateDogs | IG, FB & SC: WeRateDogs MOBILE APP: @GoodDogsGame | Business: dogratingtwitter@gmail.com",https://t.co/iazoiNUviP,https://twitter.com/dog_rates/status/679736210798047232/photo/1
679729593985699840,114031,937,This is Hunter. He was playing with his ball minding his own business. Has no idea what happened to the carpet. 8/10 https://t.co/DbUTDI3u1R,"#1 Source for Professional Dog Ratings | STORE: @ShopWeRateDogs | IG, FB & SC: WeRateDogs MOBILE APP: @GoodDogsGame | Business: dogratingtwitter@gmail.com",https://t.co/DbUTDI3u1R,https://twitter.com/dog_rates/status/679729593985699840/photo/1
679722016581222400,114031,539,This is Mike. He is a Jordanian Frito Pilates. Frowning because he can't see directly in front of him. 8/10 https://t.co/NL5QJwdEpF,"#1 Source for Professional Dog Ratings | STORE: @ShopWeRateDogs | IG, FB & SC: WeRateDogs MOBILE APP: @GoodDogsGame | Business: dogratingtwitter@gmail.com",https://t.co/NL5QJwdEpF,https://twitter.com/dog_rates/status/679722016581222400/photo/1
679530280114372609,114031,2347,Guys this really needs to stop. We've been over this way too many times. This is a giraffe. We only rate dogs.. 7/10 https://t.co/yavgkHYPOC,"#1 Source for Professional Dog Ratings | STORE: @ShopWeRateDogs | IG, FB & SC: WeRateDogs MOBILE APP: @GoodDogsGame | Business: dogratingtwitter@gmail.com",https://t.co/yavgkHYPOC,https://twitter.com/dog_rates/status/679530280114372609/photo/1
679527802031484928,114031,823,This little pupper just arrived. 11/10 would snug https://t.co/DA5aqnSGfB,"#1 Source for Professional Dog Ratings | STORE: @ShopWeRateDogs | IG, FB & SC: WeRateDogs MOBILE APP: @GoodDogsGame | Business: dogratingtwitter@gmail.com",https://t.co/DA5aqnSGfB,https://twitter.com/dog_rates/status/679527802031484928/photo/1
679511351870550016,114031,1461,Say hello to William. He makes fun of others because he's terrified of his own deep-seated insecurities. 7/10 https://t.co/bwuV6FlRxr,"#1 Source for Professional Dog Ratings | STORE: @ShopWeRateDogs | IG, FB & SC: WeRateDogs MOBILE APP: @GoodDogsGame | Business: dogratingtwitter@gmail.com",https://t.co/bwuV6FlRxr,https://twitter.com/dog_rates/status/679511351870550016/photo/1
679503373272485890,114031,1673,This is Dwight. He's a pointy pupper. Very docile. Attracts marshmallows. Hurts to pet but definitely worth it 8/10 https://t.co/jjW7zTxY9Z,"#1 Source for Professional Dog Ratings | STORE: @ShopWeRateDogs | IG, FB & SC: WeRateDogs MOBILE APP: @GoodDogsGame | Business: dogratingtwitter@gmail.com",https://t.co/jjW7zTxY9Z,https://twitter.com/dog_rates/status/679503373272485890/photo/1
679475951516934144,114031,728,This is Evy. She doesn't want to be a Koala. 9/10 https://t.co/VITeF0Kl9L,"#1 Source for Professional Dog Ratings | STORE: @ShopWeRateDogs | IG, FB & SC: WeRateDogs MOBILE APP: @GoodDogsGame | Business: dogratingtwitter@gmail.com",https://t.co/VITeF0Kl9L,https://twitter.com/dog_rates/status/679475951516934144/photo/1
679462823135686656,114031,21324,Meet Hurley. He's the curly one. He hugs every other dog he sees during his walk. 11/10 for spreading the love https://t.co/M6vqkt2GKV,"#1 Source for Professional Dog Ratings | STORE: @ShopWeRateDogs | IG, FB & SC: WeRateDogs MOBILE APP: @GoodDogsGame | Business: dogratingtwitter@gmail.com",https://t.co/M6vqkt2GKV,https://twitter.com/dog_rates/status/679462823135686656/photo/1
679405845277462528,114031,1364,Crazy unseen footage from Jurassic Park. 10/10 for both dinosaur puppers https://t.co/L8wt2IpwxO,"#1 Source for Professional Dog Ratings | STORE: @ShopWeRateDogs | IG, FB & SC: WeRateDogs MOBILE APP: @GoodDogsGame | Business: dogratingtwitter@gmail.com",NaN,NaN
679158373988876288,114031,9193,This is Rubio. He has too much skin. 11/10 https://t.co/NLOHmlENag,"#1 Source for Professional Dog Ratings | STORE: @ShopWeRateDogs | IG, FB & SC: WeRateDogs MOBILE APP: @GoodDogsGame | Business: dogratingtwitter@gmail.com",https://t.co/NLOHmlENag,https://twitter.com/dog_rates/status/679158373988876288/photo/1
679148763231985668,114031,1163,I know everyone's excited for Christmas but that doesn't mean you can send in reindeer. We only rate dogs... 8/10 https://t.co/eWjWgbOCYL,"#1 Source for Professional Dog Ratings | STORE: @ShopWeRateDogs | IG, FB & SC: WeRateDogs MOBILE APP: @GoodDogsGame | Business: dogratingtwitter@gmail.com",https://t.co/eWjWgbOCYL,https://twitter.com/dog_rates/status/679148763231985668/photo/1
679132435750195208,114031,1314,This is Louis. He's a river dancer. His friends think it's badass. All are very supportive. 10/10 for Louis https://t.co/qoIvjKMY58,"#1 Source for Professional Dog Ratings | STORE: @ShopWeRateDogs | IG, FB & SC: WeRateDogs MOBILE APP: @GoodDogsGame | Business: dogratingtwitter@gmail.com",https://t.co/qoIvjKMY58,https://twitter.com/dog_rates/status/679132435750195208/photo/1
679111216690831360,114031,2893,This is officially the greatest yawn of all time. 12/10 https://t.co/4R0Cc0sLVE,"#1 Source for Professional Dog Ratings | STORE: @ShopWeRateDogs | IG, FB & SC: WeRateDogs MOBILE APP: @GoodDogsGame | Business: dogratingtwitter@gmail.com",https://t.co/4R0Cc0sLVE,https://twitter.com/dog_rates/status/679111216690831360/video/1
679062614270468097,114031,9299,This is Chompsky. He lives up to his name. 11/10 https://t.co/Xl37lQEWd0,"#1 Source for Professional Dog Ratings | STORE: @ShopWeRateDogs | IG, FB & SC: WeRateDogs MOBILE APP: @GoodDogsGame | Business: dogratingtwitter@gmail.com",https://t.co/Xl37lQEWd0,https://twitter.com/dog_rates/status/679062614270468097/photo/1
679047485189439488,114031,781,This dog doesn't know how to stairs. Quite tragic really. 9/10 get it together pup https://t.co/kTpr9PTMg1,"#1 Source for Professional Dog Ratings | STORE: @ShopWeRateDogs | IG, FB & SC: WeRateDogs MOBILE APP: @GoodDogsGame | Business: dogratingtwitter@gmail.com",https://t.co/kTpr9PTMg1,https://twitter.com/dog_rates/status/679047485189439488/photo/1
679001094530465792,114031,1378,This is Rascal. He's paddling an imaginary canoe. 11/10 https://t.co/Ajquq6oGSg,"#1 Source for Professional Dog Ratings | STORE: @ShopWeRateDogs | IG, FB & SC: WeRateDogs MOBILE APP: @GoodDogsGame | Business: dogratingtwitter@gmail.com",NaN,NaN
678991772295516161,114031,1333,If your Monday isn't going so well just take a look at this. Both 12/10 https://t.co/GJT6SILPGU,"#1 Source for Professional Dog Ratings | STORE: @ShopWeRateDogs | IG, FB & SC: WeRateDogs MOBILE APP: @GoodDogsGame | Business: dogratingtwitter@gmail.com",https://t.co/GJT6SILPGU,https://twitter.com/dog_rates/status/678991772295516161/photo/1
678969228704284672,114031,528,Meet Lola. She's a Metamorphic Chartreuse. Plays with her food. Insubordinate and churlish. Exquisite hardwood 11/10 https://t.co/etpBNXwN7f,"#1 Source for Professional Dog Ratings | STORE: @ShopWeRateDogs | IG, FB & SC: WeRateDogs MOBILE APP: @GoodDogsGame | Business: dogratingtwitter@gmail.com",https://t.co/etpBNXwN7f,https://twitter.com/dog_rates/status/678969228704284672/photo/1
678800283649069056,114031,1018,Here's a pupper with some mean tan lines. Snazzy sweater though 12/10 https://t.co/DpCSVsl6vu,"#1 Source for Professional Dog Ratings | STORE: @ShopWeRateDogs | IG, FB & SC: WeRateDogs MOBILE APP: @GoodDogsGame | Business: dogratingtwitter@gmail.com",https://t.co/DpCSVsl6vu,https://twitter.com/dog_rates/status/678800283649069056/photo/1
678798276842360832,114031,1350,This is Linda. She fucking hates trees. 7/10 https://t.co/blaY85FIxR,"#1 Source for Professional Dog Ratings | STORE: @ShopWeRateDogs | IG, FB & SC: WeRateDogs MOBILE APP: @GoodDogsGame | Business: dogratingtwitter@gmail.com",https://t.co/blaY85FIxR,https://twitter.com/dog_rates/status/678798276842360832/photo/1
678774928607469569,114031,1043,This is Tug. He's not required to wear the cone he just wants his voice to project more clearly. 11/10 https://t.co/Sp739Ou2qx,"#1 Source for Professional Dog Ratings | STORE: @ShopWeRateDogs | IG, FB & SC: WeRateDogs MOBILE APP: @GoodDogsGame | Business: dogratingtwitter@gmail.com",https://t.co/Sp739Ou2qx,https://twitter.com/dog_rates/status/678774928607469569/photo/1
678767140346941444,114031,1553,This is Mia. She makes awful decisions. 8/10 https://t.co/G6TQVgTcZz,"#1 Source for Professional Dog Ratings | STORE: @ShopWeRateDogs | IG, FB & SC: WeRateDogs MOBILE APP: @GoodDogsGame | Business: dogratingtwitter@gmail.com",https://t.co/G6TQVgTcZz,https://twitter.com/dog_rates/status/678767140346941444/photo/1
678764513869611008,114031,544,"Meet Wilson. He got caught humping the futon. He's like ""dude, help me out here"" 10/10 I'd help Wilson out https://t.co/m6XoclB0qv","#1 Source for Professional Dog Ratings | STORE: @ShopWeRateDogs | IG, FB & SC: WeRateDogs MOBILE APP: @GoodDogsGame | Business: dogratingtwitter@gmail.com",https://t.co/m6XoclB0qv,https://twitter.com/dog_rates/status/678764513869611008/photo/1
678755239630127104,114031,3741,This is Dash. He didn't think the water would be that cold. Damn it Dash it's December. Think a little. 10/10 https://t.co/NqcOwG8pxW,"#1 Source for Professional Dog Ratings | STORE: @ShopWeRateDogs | IG, FB & SC: WeRateDogs MOBILE APP: @GoodDogsGame | Business: dogratingtwitter@gmail.com",https://t.co/NqcOwG8pxW,https://twitter.com/dog_rates/status/678755239630127104/photo/1
678740035362037760,114031,1926,Meet Tango. He's a large dog. Doesn't care much for personal space. Owner isn't very accepting. Tongue slip. 6/10 https://t.co/p2T5kGebxe,"#1 Source for Professional Dog Ratings | STORE: @ShopWeRateDogs | IG, FB & SC: WeRateDogs MOBILE APP: @GoodDogsGame | Business: dogratingtwitter@gmail.com",https://t.co/p2T5kGebxe,https://twitter.com/dog_rates/status/678740035362037760/photo/1
678708137298427904,114031,2753,Here we are witnessing a wild field pupper. Lost his wallet in there. Rather unfortunate. 10/10 good luck pup https://t.co/sZy9Co74Bw,"#1 Source for Professional Dog Ratings | STORE: @ShopWeRateDogs | IG, FB & SC: WeRateDogs MOBILE APP: @GoodDogsGame | Business: dogratingtwitter@gmail.com",NaN,NaN
678675843183484930,114031,1680,Exotic pup here. Tail long af. Throat looks swollen. Might breathe fire. Exceptionally unfluffy 2/10 would still pet https://t.co/a8SqCaSo2r,"#1 Source for Professional Dog Ratings | STORE: @ShopWeRateDogs | IG, FB & SC: WeRateDogs MOBILE APP: @GoodDogsGame | Business: dogratingtwitter@gmail.com",https://t.co/a8SqCaSo2r,https://twitter.com/dog_rates/status/678675843183484930/photo/1
678643457146150913,114031,489,Meet Grizz. He just arrived. Couldn't wait until Christmas. Worried bc he saw the swastikas on the carpet. 10/10 https://t.co/QBGwYrT7rv,"#1 Source for Professional Dog Ratings | STORE: @ShopWeRateDogs | IG, FB & SC: WeRateDogs MOBILE APP: @GoodDogsGame | Business: dogratingtwitter@gmail.com",https://t.co/QBGwYrT7rv,https://twitter.com/dog_rates/status/678643457146150913/photo/1
678446151570427904,114031,1785,Touching scene here. Really stirs up the emotions. The bond between father &amp; son. So beautiful. 10/10 for both pups https://t.co/AJWJHov5gx,"#1 Source for Professional Dog Ratings | STORE: @ShopWeRateDogs | IG, FB & SC: WeRateDogs MOBILE APP: @GoodDogsGame | Business: dogratingtwitter@gmail.com",https://t.co/AJWJHov5gx,https://twitter.com/dog_rates/status/678446151570427904/photo/1
678424312106393600,114031,2880,This is Crystal. She's a shitty fireman. No sense of urgency. People could be dying Crystal. 2/10 just irresponsible https://t.co/rtMtjSl9pz,"#1 Source for Professional Dog Ratings | STORE: @ShopWeRateDogs | IG, FB & SC: WeRateDogs MOBILE APP: @GoodDogsGame | Business: dogratingtwitter@gmail.com",https://t.co/rtMtjSl9pz,https://twitter.com/dog_rates/status/678424312106393600/photo/1
678410210315247616,114031,2072,Say hello to Jerome. He can shoot french fries out of his mouth at insane speeds. Deadly af. 10/10 https://t.co/dIy88HwrX8,"#1 Source for Professional Dog Ratings | STORE: @ShopWeRateDogs | IG, FB & SC: WeRateDogs MOBILE APP: @GoodDogsGame | Business: dogratingtwitter@gmail.com",https://t.co/dIy88HwrX8,https://twitter.com/dog_rates/status/678410210315247616/photo/1
678399652199309312,114031,30742,This made my day. 12/10 please enjoy https://t.co/VRTbo3aAcm,"#1 Source for Professional Dog Ratings | STORE: @ShopWeRateDogs | IG, FB & SC: WeRateDogs MOBILE APP: @GoodDogsGame | Business: dogratingtwitter@gmail.com",https://t.co/VRTbo3aAcm,https://twitter.com/dog_rates/status/678399652199309312/video/1
678396796259975168,114032,478,These little fellas have opposite facial expressions. Both 12/10 https://t.co/LmThv0GWen,"#1 Source for Professional Dog Ratings | STORE: @ShopWeRateDogs | IG, FB & SC: WeRateDogs MOBILE APP: @GoodDogsGame | Business: dogratingtwitter@gmail.com",https://t.co/LmThv0GWen,https://twitter.com/dog_rates/status/678396796259975168/photo/1
678389028614488064,114031,473,"This is Bella. She just learned that her final grade in chem was a 92.49 
poor pupper 11/10 https://t.co/auOoKuoveM","#1 Source for Professional Dog Ratings | STORE: @ShopWeRateDogs | IG, FB & SC: WeRateDogs MOBILE APP: @GoodDogsGame | Business: dogratingtwitter@gmail.com",https://t.co/auOoKuoveM,https://twitter.com/dog_rates/status/678389028614488064/photo/1
678380236862578688,114031,1020,This is Crumpet. He underestimated the snow. Quickly retreating. 10/10 https://t.co/a0Zx5LDFZa,"#1 Source for Professional Dog Ratings | STORE: @ShopWeRateDogs | IG, FB & SC: WeRateDogs MOBILE APP: @GoodDogsGame | Business: dogratingtwitter@gmail.com",https://t.co/a0Zx5LDFZa,https://twitter.com/dog_rates/status/678380236862578688/photo/1
678341075375947776,114031,612,This pupper likes tape. 12/10 https://t.co/cSp6w5GWgm,"#1 Source for Professional Dog Ratings | STORE: @ShopWeRateDogs | IG, FB & SC: WeRateDogs MOBILE APP: @GoodDogsGame | Business: dogratingtwitter@gmail.com",https://t.co/cSp6w5GWgm,https://twitter.com/dog_rates/status/678341075375947776/photo/1
678334497360859136,114031,304,This is Rosie. She has a snazzy bow tie and a fin for a tail. Probably super fast underwater. Cool socks 10/10 https://t.co/GO76MdGBs0,"#1 Source for Professional Dog Ratings | STORE: @ShopWeRateDogs | IG, FB & SC: WeRateDogs MOBILE APP: @GoodDogsGame | Business: dogratingtwitter@gmail.com",https://t.co/GO76MdGBs0,https://twitter.com/dog_rates/status/678334497360859136/photo/1
678278586130948096,114031,6857,Another spooky pupper here. Most definitely floating. No legs. Probably knows some dark magic. 10/10 very spooked https://t.co/JK8MByRzgj,"#1 Source for Professional Dog Ratings | STORE: @ShopWeRateDogs | IG, FB & SC: WeRateDogs MOBILE APP: @GoodDogsGame | Business: dogratingtwitter@gmail.com",https://t.co/JK8MByRzgj,https://twitter.com/dog_rates/status/678278586130948096/photo/1
678255464182861824,114031,418,This is Jessifer. She is a Bismoth Teriyaki. Flowers being attacked by hurricanes on bandana (rad). 9/10 stellar pup https://t.co/nZhmRwZzWv,"#1 Source for Professional Dog Ratings | STORE: @ShopWeRateDogs | IG, FB & SC: WeRateDogs MOBILE APP: @GoodDogsGame | Business: dogratingtwitter@gmail.com",https://t.co/nZhmRwZzWv,https://twitter.com/dog_rates/status/678255464182861824/photo/1
678023323247357953,114031,439,After getting lost in Reese's eyes for several minutes we're going to upgrade him to a 13/10,"#1 Source for Professional Dog Ratings | STORE: @ShopWeRateDogs | IG, FB & SC: WeRateDogs MOBILE APP: @GoodDogsGame | Business: dogratingtwitter@gmail.com",NaN,NaN
678021115718029313,114031,7148,This is Reese. He likes holding hands. 12/10 https://t.co/cbLroGCbmh,"#1 Source for Professional Dog Ratings | STORE: @ShopWeRateDogs | IG, FB & SC: WeRateDogs MOBILE APP: @GoodDogsGame | Business: dogratingtwitter@gmail.com",https://t.co/cbLroGCbmh,https://twitter.com/dog_rates/status/678021115718029313/photo/1
677961670166224897,114031,1879,This is Izzy. She's showing off the dance moves she's been working on. 11/10 I guess hard work pays off https://t.co/4JS92YAxTi,"#1 Source for Professional Dog Ratings | STORE: @ShopWeRateDogs | IG, FB & SC: WeRateDogs MOBILE APP: @GoodDogsGame | Business: dogratingtwitter@gmail.com",NaN,NaN
677918531514703872,114031,463,"""Everything looks pretty good in there. Make sure to brush your gums. Been flossing? How's school going?"" Both 10/10 https://t.co/lWL2IMJqLR","#1 Source for Professional Dog Ratings | STORE: @ShopWeRateDogs | IG, FB & SC: WeRateDogs MOBILE APP: @GoodDogsGame | Business: dogratingtwitter@gmail.com",https://t.co/lWL2IMJqLR,https://twitter.com/dog_rates/status/677918531514703872/photo/1
677895101218201600,114031,2384,Guys this was terrifying. Really spooked me up. We don't rate ghosts. We rate dogs. Please only send dogs... 9/10 https://t.co/EJImi1udYb,"#1 Source for Professional Dog Ratings | STORE: @ShopWeRateDogs | IG, FB & SC: WeRateDogs MOBILE APP: @GoodDogsGame | Business: dogratingtwitter@gmail.com",https://t.co/EJImi1udYb,https://twitter.com/dog_rates/status/677895101218201600/photo/1
677716515794329600,114031,1104,IT'S PUPPERGEDDON. Total of 144/120 ...I think https://t.co/ZanVtAtvIq,"#1 Source for Professional Dog Ratings | STORE: @ShopWeRateDogs | IG, FB & SC: WeRateDogs MOBILE APP: @GoodDogsGame | Business: dogratingtwitter@gmail.com",https://t.co/ZanVtAtvIq,https://twitter.com/dog_rates/status/677716515794329600/photo/1
677700003327029250,114031,1622,This is Ralph. He's an interpretive dancer. 10/10 https://t.co/zoDdPyPFsa,"#1 Source for Professional Dog Ratings | STORE: @ShopWeRateDogs | IG, FB & SC: WeRateDogs MOBILE APP: @GoodDogsGame | Business: dogratingtwitter@gmail.com",https://t.co/zoDdPyPFsa,https://twitter.com/dog_rates/status/677700003327029250/photo/1
677698403548192770,114031,363,This is Sadie. She got her holidays confused. 9/10 damn it Sadie https://t.co/fm7HxOsuPK,"#1 Source for Professional Dog Ratings | STORE: @ShopWeRateDogs | IG, FB & SC: WeRateDogs MOBILE APP: @GoodDogsGame | Business: dogratingtwitter@gmail.com",https://t.co/fm7HxOsuPK,https://twitter.com/dog_rates/status/677698403548192770/photo/1
677687604918272002,114031,950,This was Cindy's face when she heard Susan forgot the snacks for after the kid's soccer game. 11/10 https://t.co/gzkuVGRgAD,"#1 Source for Professional Dog Ratings | STORE: @ShopWeRateDogs | IG, FB & SC: WeRateDogs MOBILE APP: @GoodDogsGame | Business: dogratingtwitter@gmail.com",https://t.co/gzkuVGRgAD,https://twitter.com/dog_rates/status/677687604918272002/photo/1
677673981332312066,114031,1677,Endangered triangular pup here. Could be a wizard. Caught mid-laugh. No legs. Just fluff. Probably a wizard. 9/10 https://t.co/GFVIHIod0Z,"#1 Source for Professional Dog Ratings | STORE: @ShopWeRateDogs | IG, FB & SC: WeRateDogs MOBILE APP: @GoodDogsGame | Business: dogratingtwitter@gmail.com",https://t.co/GFVIHIod0Z,https://twitter.com/dog_rates/status/677673981332312066/photo/1
677662372920729601,114031,1101,"In honor of the new Star Wars movie. Here's Yoda pug. 12/10 pet really well, would I https://t.co/pvjdRn00XH","#1 Source for Professional Dog Ratings | STORE: @ShopWeRateDogs | IG, FB & SC: WeRateDogs MOBILE APP: @GoodDogsGame | Business: dogratingtwitter@gmail.com",https://t.co/pvjdRn00XH,https://twitter.com/dog_rates/status/677662372920729601/photo/1
677644091929329666,114031,886,This is a dog swinging. I really enjoyed it so I hope you all do as well. 11/10 https://t.co/Ozo9KHTRND,"#1 Source for Professional Dog Ratings | STORE: @ShopWeRateDogs | IG, FB & SC: WeRateDogs MOBILE APP: @GoodDogsGame | Business: dogratingtwitter@gmail.com",https://t.co/Ozo9KHTRND,https://twitter.com/dog_rates/status/677644091929329666/video/1
677573743309385728,114031,819,This is Sandy. He's sexually confused. Thinks he's a pigeon. Also an All-American cheese catcher. 10/10 so petable https://t.co/Htu8plSqEu,"#1 Source for Professional Dog Ratings | STORE: @ShopWeRateDogs | IG, FB & SC: WeRateDogs MOBILE APP: @GoodDogsGame | Business: dogratingtwitter@gmail.com",https://t.co/Htu8plSqEu,https://twitter.com/dog_rates/status/677573743309385728/photo/1
677565715327688705,114031,513,Contortionist pup here. Inside pentagram. Clearly worships Satan. Known to slowly push fragile stuff off tables 6/10 https://t.co/EX9oR55VMe,"#1 Source for Professional Dog Ratings | STORE: @ShopWeRateDogs | IG, FB & SC: WeRateDogs MOBILE APP: @GoodDogsGame | Business: dogratingtwitter@gmail.com",https://t.co/EX9oR55VMe,https://twitter.com/dog_rates/status/677565715327688705/photo/1
677557565589463040,114031,1322,Reckless pupper here. Not even looking at road. Absolute menace. No regard for fellow pupper lives. 10/10 still cute https://t.co/96IBkOYB7j,"#1 Source for Professional Dog Ratings | STORE: @ShopWeRateDogs | IG, FB & SC: WeRateDogs MOBILE APP: @GoodDogsGame | Business: dogratingtwitter@gmail.com",https://t.co/96IBkOYB7j,https://twitter.com/dog_rates/status/677557565589463040/photo/1
677547928504967168,114031,4076,Not much to say here. I just think everyone needs to see this. 12/10 https://t.co/AGag0hFHpe,"#1 Source for Professional Dog Ratings | STORE: @ShopWeRateDogs | IG, FB & SC: WeRateDogs MOBILE APP: @GoodDogsGame | Business: dogratingtwitter@gmail.com",https://t.co/AGag0hFHpe,https://twitter.com/dog_rates/status/677547928504967168/photo/1
677530072887205888,114031,250,Say hello to Axel. He's a Black Chevy Pinot on wheels. 0 to 60 in 5.7 seconds (if downhill). 9/10 I call shotgun https://t.co/DKe9DBnnHE,"#1 Source for Professional Dog Ratings | STORE: @ShopWeRateDogs | IG, FB & SC: WeRateDogs MOBILE APP: @GoodDogsGame | Business: dogratingtwitter@gmail.com",https://t.co/DKe9DBnnHE,https://twitter.com/dog_rates/status/677530072887205888/photo/1
677335745548390400,114031,2017,Downright inspiring 12/10 https://t.co/vSLtYBWHcQ,"#1 Source for Professional Dog Ratings | STORE: @ShopWeRateDogs | IG, FB & SC: WeRateDogs MOBILE APP: @GoodDogsGame | Business: dogratingtwitter@gmail.com",NaN,NaN
677334615166730240,114031,328,This dog gave up mid jump. 9/10 https://t.co/KmMv3Y2zI8,"#1 Source for Professional Dog Ratings | STORE: @ShopWeRateDogs | IG, FB & SC: WeRateDogs MOBILE APP: @GoodDogsGame | Business: dogratingtwitter@gmail.com",https://t.co/KmMv3Y2zI8,https://twitter.com/dog_rates/status/677334615166730240/photo/1
677331501395156992,114031,265,Meet Humphrey. He's a Northern Polyp Viagra. One ear works. Face stuck like that. Always surprised. 9/10 petable af https://t.co/FS7eJQM2F4,"#1 Source for Professional Dog Ratings | STORE: @ShopWeRateDogs | IG, FB & SC: WeRateDogs MOBILE APP: @GoodDogsGame | Business: dogratingtwitter@gmail.com",https://t.co/FS7eJQM2F4,https://twitter.com/dog_rates/status/677331501395156992/photo/1
677328882937298944,114031,1693,This is Derek. All the dogs adore Derek. He's a great guy. 10/10 really solid pup https://t.co/KgcsGNb61s,"#1 Source for Professional Dog Ratings | STORE: @ShopWeRateDogs | IG, FB & SC: WeRateDogs MOBILE APP: @GoodDogsGame | Business: dogratingtwitter@gmail.com",https://t.co/KgcsGNb61s,https://twitter.com/dog_rates/status/677328882937298944/photo/1
